date,timestamp,price,daily_high,block_height,epoch,epoch_height,subsidy,supply,market_cap,eod_utc
1/3/09,2009-01-03 23:59:59,0.0,0.0,0,1,0,50.0,50.0,0.0,True
1/4/09,2009-01-04 23:59:59,0.0,0.0,0,1,0,50.0,50.0,0.0,True
1/5/09,2009-01-05 23:59:59,0.0,0.0,0,1,0,50.0,50.0,0.0,True
1/6/09,2009-01-06 23:59:59,0.0,0.0,0,1,0,50.0,50.0,0.0,True
1/7/09,2009-01-07 23:59:59,0.0,0.0,0,1,0,50.0,50.0,0.0,True
1/8/09,2009-01-08 23:59:59,0.0,0.0,0,1,0,50.0,50.0,0.0,True
1/9/09,2009-01-09 23:59:59,0.0,0.0,14,1,14,50.0,750.0,0.0,True
1/10/09,2009-01-10 23:59:59,0.0,0.0,75,1,75,50.0,3800.0,0.0,True
1/11/09,2009-01-11 23:59:59,0.0,0.0,168,1,168,50.0,8450.0,0.0,True
1/12/09,2009-01-12 23:59:59,0.0,0.0,262,1,262,50.0,13150.0,0.0,True
1/13/09,2009-01-13 23:59:59,0.0,0.0,385,1,385,50.0,19300.0,0.0,True
1/14/09,2009-01-14 23:59:59,0.0,0.0,514,1,514,50.0,25750.0,0.0,True
1/15/09,2009-01-15 23:59:59,0.0,0.0,640,1,640,50.0,32050.0,0.0,True
1/16/09,2009-01-16 23:59:59,0.0,0.0,748,1,748,50.0,37450.0,0.0,True
1/17/09,2009-01-17 23:59:59,0.0,0.0,857,1,857,50.0,42900.0,0.0,True
1/18/09,2009-01-18 23:59:59,0.0,0.0,964,1,964,50.0,48250.0,0.0,True
1/19/09,2009-01-19 23:59:59,0.0,0.0,1079,1,1079,50.0,54000.0,0.0,True
1/20/09,2009-01-20 23:59:59,0.0,0.0,1193,1,1193,50.0,59700.0,0.0,True
1/21/09,2009-01-21 23:59:59,0.0,0.0,1295,1,1295,50.0,64800.0,0.0,True
1/22/09,2009-01-22 23:59:59,0.0,0.0,1386,1,1386,50.0,69350.0,0.0,True
1/23/09,2009-01-23 23:59:59,0.0,0.0,1470,1,1470,50.0,73550.0,0.0,True
1/24/09,2009-01-24 23:59:59,0.0,0.0,1671,1,1671,50.0,83600.0,0.0,True
1/25/09,2009-01-25 23:59:59,0.0,0.0,1862,1,1862,50.0,93150.0,0.0,True
1/26/09,2009-01-26 23:59:59,0.0,0.0,1958,1,1958,50.0,97950.0,0.0,True
1/27/09,2009-01-27 23:59:59,0.0,0.0,2055,1,2055,50.0,102800.0,0.0,True
1/28/09,2009-01-28 23:59:59,0.0,0.0,2167,1,2167,50.0,108400.0,0.0,True
1/29/09,2009-01-29 23:59:59,0.0,0.0,2288,1,2288,50.0,114450.0,0.0,True
1/30/09,2009-01-30 23:59:59,0.0,0.0,2405,1,2405,50.0,120300.0,0.0,True
1/31/09,2009-01-31 23:59:59,0.0,0.0,2543,1,2543,50.0,127200.0,0.0,True
2/1/09,2009-02-01 23:59:59,0.0,0.0,2656,1,2656,50.0,132850.0,0.0,True
2/2/09,2009-02-02 23:59:59,0.0,0.0,2784,1,2784,50.0,139250.0,0.0,True
2/3/09,2009-02-03 23:59:59,0.0,0.0,2923,1,2923,50.0,146200.0,0.0,True
2/4/09,2009-02-04 23:59:59,0.0,0.0,3042,1,3042,50.0,152150.0,0.0,True
2/5/09,2009-02-05 23:59:59,0.0,0.0,3168,1,3168,50.0,158450.0,0.0,True
2/6/09,2009-02-06 23:59:59,0.0,0.0,3290,1,3290,50.0,164550.0,0.0,True
2/7/09,2009-02-07 23:59:59,0.0,0.0,3419,1,3419,50.0,171000.0,0.0,True
2/8/09,2009-02-08 23:59:59,0.0,0.0,3551,1,3551,50.0,177600.0,0.0,True
2/9/09,2009-02-09 23:59:59,0.0,0.0,3685,1,3685,50.0,184300.0,0.0,True
2/10/09,2009-02-10 23:59:59,0.0,0.0,3805,1,3805,50.0,190300.0,0.0,True
2/11/09,2009-02-11 23:59:59,0.0,0.0,3938,1,3938,50.0,196950.0,0.0,True
2/12/09,2009-02-12 23:59:59,0.0,0.0,4057,1,4057,50.0,202900.0,0.0,True
2/13/09,2009-02-13 23:59:59,0.0,0.0,4181,1,4181,50.0,209100.0,0.0,True
2/14/09,2009-02-14 23:59:59,0.0,0.0,4317,1,4317,50.0,215900.0,0.0,True
2/15/09,2009-02-15 23:59:59,0.0,0.0,4445,1,4445,50.0,222300.0,0.0,True
2/16/09,2009-02-16 23:59:59,0.0,0.0,4567,1,4567,50.0,228400.0,0.0,True
2/17/09,2009-02-17 23:59:59,0.0,0.0,4684,1,4684,50.0,234250.0,0.0,True
2/18/09,2009-02-18 23:59:59,0.0,0.0,4802,1,4802,50.0,240150.0,0.0,True
2/19/09,2009-02-19 23:59:59,0.0,0.0,4926,1,4926,50.0,246350.0,0.0,True
2/20/09,2009-02-20 23:59:59,0.0,0.0,5048,1,5048,50.0,252450.0,0.0,True
2/21/09,2009-02-21 23:59:59,0.0,0.0,5162,1,5162,50.0,258150.0,0.0,True
2/22/09,2009-02-22 23:59:59,0.0,0.0,5283,1,5283,50.0,264200.0,0.0,True
2/23/09,2009-02-23 23:59:59,0.0,0.0,5391,1,5391,50.0,269600.0,0.0,True
2/24/09,2009-02-24 23:59:59,0.0,0.0,5497,1,5497,50.0,274900.0,0.0,True
2/25/09,2009-02-25 23:59:59,0.0,0.0,5602,1,5602,50.0,280150.0,0.0,True
2/26/09,2009-02-26 23:59:59,0.0,0.0,5709,1,5709,50.0,285500.0,0.0,True
2/27/09,2009-02-27 23:59:59,0.0,0.0,5824,1,5824,50.0,291250.0,0.0,True
2/28/09,2009-02-28 23:59:59,0.0,0.0,5923,1,5923,50.0,296200.0,0.0,True
3/1/09,2009-03-01 23:59:59,0.0,0.0,6028,1,6028,50.0,301450.0,0.0,True
3/2/09,2009-03-02 23:59:59,0.0,0.0,6136,1,6136,50.0,306850.0,0.0,True
3/3/09,2009-03-03 23:59:59,0.0,0.0,6241,1,6241,50.0,312100.0,0.0,True
3/4/09,2009-03-04 23:59:59,0.0,0.0,6345,1,6345,50.0,317300.0,0.0,True
3/5/09,2009-03-05 23:59:59,0.0,0.0,6457,1,6457,50.0,322900.0,0.0,True
3/6/09,2009-03-06 23:59:59,0.0,0.0,6574,1,6574,50.0,328750.0,0.0,True
3/7/09,2009-03-07 23:59:59,0.0,0.0,6683,1,6683,50.0,334200.0,0.0,True
3/8/09,2009-03-08 23:59:59,0.0,0.0,6798,1,6798,50.0,339950.0,0.0,True
3/9/09,2009-03-09 23:59:59,0.0,0.0,6906,1,6906,50.0,345350.0,0.0,True
3/10/09,2009-03-10 23:59:59,0.0,0.0,7013,1,7013,50.0,350700.0,0.0,True
3/11/09,2009-03-11 23:59:59,0.0,0.0,7127,1,7127,50.0,356400.0,0.0,True
3/12/09,2009-03-12 23:59:59,0.0,0.0,7245,1,7245,50.0,362300.0,0.0,True
3/13/09,2009-03-13 23:59:59,0.0,0.0,7358,1,7358,50.0,367950.0,0.0,True
3/14/09,2009-03-14 23:59:59,0.0,0.0,7468,1,7468,50.0,373450.0,0.0,True
3/15/09,2009-03-15 23:59:59,0.0,0.0,7591,1,7591,50.0,379600.0,0.0,True
3/16/09,2009-03-16 23:59:59,0.0,0.0,7712,1,7712,50.0,385650.0,0.0,True
3/17/09,2009-03-17 23:59:59,0.0,0.0,7826,1,7826,50.0,391350.0,0.0,True
3/18/09,2009-03-18 23:59:59,0.0,0.0,7940,1,7940,50.0,397050.0,0.0,True
3/19/09,2009-03-19 23:59:59,0.0,0.0,8062,1,8062,50.0,403150.0,0.0,True
3/20/09,2009-03-20 23:59:59,0.0,0.0,8180,1,8180,50.0,409050.0,0.0,True
3/21/09,2009-03-21 23:59:59,0.0,0.0,8230,1,8230,50.0,411550.0,0.0,True
3/22/09,2009-03-22 23:59:59,0.0,0.0,8349,1,8349,50.0,417500.0,0.0,True
3/23/09,2009-03-23 23:59:59,0.0,0.0,8479,1,8479,50.0,424000.0,0.0,True
3/24/09,2009-03-24 23:59:59,0.0,0.0,8584,1,8584,50.0,429250.0,0.0,True
3/25/09,2009-03-25 23:59:59,0.0,0.0,8701,1,8701,50.0,435100.0,0.0,True
3/26/09,2009-03-26 23:59:59,0.0,0.0,8818,1,8818,50.0,440950.0,0.0,True
3/27/09,2009-03-27 23:59:59,0.0,0.0,8924,1,8924,50.0,446250.0,0.0,True
3/28/09,2009-03-28 23:59:59,0.0,0.0,9043,1,9043,50.0,452200.0,0.0,True
3/29/09,2009-03-29 23:59:59,0.0,0.0,9159,1,9159,50.0,458000.0,0.0,True
3/30/09,2009-03-30 23:59:59,0.0,0.0,9279,1,9279,50.0,464000.0,0.0,True
3/31/09,2009-03-31 23:59:59,0.0,0.0,9389,1,9389,50.0,469500.0,0.0,True
4/1/09,2009-04-01 23:59:59,0.0,0.0,9503,1,9503,50.0,475200.0,0.0,True
4/2/09,2009-04-02 23:59:59,0.0,0.0,9618,1,9618,50.0,480950.0,0.0,True
4/3/09,2009-04-03 23:59:59,0.0,0.0,9734,1,9734,50.0,486750.0,0.0,True
4/4/09,2009-04-04 23:59:59,0.0,0.0,9847,1,9847,50.0,492400.0,0.0,True
4/5/09,2009-04-05 23:59:59,0.0,0.0,9977,1,9977,50.0,498900.0,0.0,True
4/6/09,2009-04-06 23:59:59,0.0,0.0,10086,1,10086,50.0,504350.0,0.0,True
4/7/09,2009-04-07 23:59:59,0.0,0.0,10186,1,10186,50.0,509350.0,0.0,True
4/8/09,2009-04-08 23:59:59,0.0,0.0,10291,1,10291,50.0,514600.0,0.0,True
4/9/09,2009-04-09 23:59:59,0.0,0.0,10390,1,10390,50.0,519550.0,0.0,True
4/10/09,2009-04-10 23:59:59,0.0,0.0,10498,1,10498,50.0,524950.0,0.0,True
4/11/09,2009-04-11 23:59:59,0.0,0.0,10618,1,10618,50.0,530950.0,0.0,True
4/12/09,2009-04-12 23:59:59,0.0,0.0,10736,1,10736,50.0,536850.0,0.0,True
4/13/09,2009-04-13 23:59:59,0.0,0.0,10851,1,10851,50.0,542600.0,0.0,True
4/14/09,2009-04-14 23:59:59,0.0,0.0,10975,1,10975,50.0,548800.0,0.0,True
4/15/09,2009-04-15 23:59:59,0.0,0.0,11088,1,11088,50.0,554450.0,0.0,True
4/16/09,2009-04-16 23:59:59,0.0,0.0,11211,1,11211,50.0,560600.0,0.0,True
4/17/09,2009-04-17 23:59:59,0.0,0.0,11323,1,11323,50.0,566200.0,0.0,True
4/18/09,2009-04-18 23:59:59,0.0,0.0,11449,1,11449,50.0,572500.0,0.0,True
4/19/09,2009-04-19 23:59:59,0.0,0.0,11568,1,11568,50.0,578450.0,0.0,True
4/20/09,2009-04-20 23:59:59,0.0,0.0,11687,1,11687,50.0,584400.0,0.0,True
4/21/09,2009-04-21 23:59:59,0.0,0.0,11810,1,11810,50.0,590550.0,0.0,True
4/22/09,2009-04-22 23:59:59,0.0,0.0,11931,1,11931,50.0,596600.0,0.0,True
4/23/09,2009-04-23 23:59:59,0.0,0.0,12006,1,12006,50.0,600350.0,0.0,True
4/24/09,2009-04-24 23:59:59,0.0,0.0,12121,1,12121,50.0,606100.0,0.0,True
4/25/09,2009-04-25 23:59:59,0.0,0.0,12239,1,12239,50.0,612000.0,0.0,True
4/26/09,2009-04-26 23:59:59,0.0,0.0,12351,1,12351,50.0,617600.0,0.0,True
4/27/09,2009-04-27 23:59:59,0.0,0.0,12455,1,12455,50.0,622800.0,0.0,True
4/28/09,2009-04-28 23:59:59,0.0,0.0,12572,1,12572,50.0,628650.0,0.0,True
4/29/09,2009-04-29 23:59:59,0.0,0.0,12700,1,12700,50.0,635050.0,0.0,True
4/30/09,2009-04-30 23:59:59,0.0,0.0,12831,1,12831,50.0,641600.0,0.0,True
5/1/09,2009-05-01 23:59:59,0.0,0.0,12952,1,12952,50.0,647650.0,0.0,True
5/2/09,2009-05-02 23:59:59,0.0,0.0,13078,1,13078,50.0,653950.0,0.0,True
5/3/09,2009-05-03 23:59:59,0.0,0.0,13184,1,13184,50.0,659250.0,0.0,True
5/4/09,2009-05-04 23:59:59,0.0,0.0,13312,1,13312,50.0,665650.0,0.0,True
5/5/09,2009-05-05 23:59:59,0.0,0.0,13447,1,13447,50.0,672400.0,0.0,True
5/6/09,2009-05-06 23:59:59,0.0,0.0,13582,1,13582,50.0,679150.0,0.0,True
5/7/09,2009-05-07 23:59:59,0.0,0.0,13704,1,13704,50.0,685250.0,0.0,True
5/8/09,2009-05-08 23:59:59,0.0,0.0,13811,1,13811,50.0,690600.0,0.0,True
5/9/09,2009-05-09 23:59:59,0.0,0.0,13889,1,13889,50.0,694500.0,0.0,True
5/10/09,2009-05-10 23:59:59,0.0,0.0,13974,1,13974,50.0,698750.0,0.0,True
5/11/09,2009-05-11 23:59:59,0.0,0.0,14094,1,14094,50.0,704750.0,0.0,True
5/12/09,2009-05-12 23:59:59,0.0,0.0,14224,1,14224,50.0,711250.0,0.0,True
5/13/09,2009-05-13 23:59:59,0.0,0.0,14335,1,14335,50.0,716800.0,0.0,True
5/14/09,2009-05-14 23:59:59,0.0,0.0,14474,1,14474,50.0,723750.0,0.0,True
5/15/09,2009-05-15 23:59:59,0.0,0.0,14610,1,14610,50.0,730550.0,0.0,True
5/16/09,2009-05-16 23:59:59,0.0,0.0,14729,1,14729,50.0,736500.0,0.0,True
5/17/09,2009-05-17 23:59:59,0.0,0.0,14856,1,14856,50.0,742850.0,0.0,True
5/18/09,2009-05-18 23:59:59,0.0,0.0,14974,1,14974,50.0,748750.0,0.0,True
5/19/09,2009-05-19 23:59:59,0.0,0.0,15060,1,15060,50.0,753050.0,0.0,True
5/20/09,2009-05-20 23:59:59,0.0,0.0,15180,1,15180,50.0,759050.0,0.0,True
5/21/09,2009-05-21 23:59:59,0.0,0.0,15262,1,15262,50.0,763150.0,0.0,True
5/22/09,2009-05-22 23:59:59,0.0,0.0,15323,1,15323,50.0,766200.0,0.0,True
5/23/09,2009-05-23 23:59:59,0.0,0.0,15355,1,15355,50.0,767800.0,0.0,True
5/24/09,2009-05-24 23:59:59,0.0,0.0,15455,1,15455,50.0,772800.0,0.0,True
5/25/09,2009-05-25 23:59:59,0.0,0.0,15564,1,15564,50.0,778250.0,0.0,True
5/26/09,2009-05-26 23:59:59,0.0,0.0,15689,1,15689,50.0,784500.0,0.0,True
5/27/09,2009-05-27 23:59:59,0.0,0.0,15808,1,15808,50.0,790450.0,0.0,True
5/28/09,2009-05-28 23:59:59,0.0,0.0,15903,1,15903,50.0,795200.0,0.0,True
5/29/09,2009-05-29 23:59:59,0.0,0.0,16009,1,16009,50.0,800500.0,0.0,True
5/30/09,2009-05-30 23:59:59,0.0,0.0,16118,1,16118,50.0,805950.0,0.0,True
5/31/09,2009-05-31 23:59:59,0.0,0.0,16214,1,16214,50.0,810750.0,0.0,True
6/1/09,2009-06-01 23:59:59,0.0,0.0,16285,1,16285,50.0,814300.0,0.0,True
6/2/09,2009-06-02 23:59:59,0.0,0.0,16396,1,16396,50.0,819850.0,0.0,True
6/3/09,2009-06-03 23:59:59,0.0,0.0,16467,1,16467,50.0,823400.0,0.0,True
6/4/09,2009-06-04 23:59:59,0.0,0.0,16533,1,16533,50.0,826700.0,0.0,True
6/5/09,2009-06-05 23:59:59,0.0,0.0,16563,1,16563,50.0,828200.0,0.0,True
6/6/09,2009-06-06 23:59:59,0.0,0.0,16591,1,16591,50.0,829600.0,0.0,True
6/7/09,2009-06-07 23:59:59,0.0,0.0,16607,1,16607,50.0,830400.0,0.0,True
6/8/09,2009-06-08 23:59:59,0.0,0.0,16689,1,16689,50.0,834500.0,0.0,True
6/9/09,2009-06-09 23:59:59,0.0,0.0,16780,1,16780,50.0,839050.0,0.0,True
6/10/09,2009-06-10 23:59:59,0.0,0.0,16862,1,16862,50.0,843150.0,0.0,True
6/11/09,2009-06-11 23:59:59,0.0,0.0,16951,1,16951,50.0,847600.0,0.0,True
6/12/09,2009-06-12 23:59:59,0.0,0.0,17037,1,17037,50.0,851900.0,0.0,True
6/13/09,2009-06-13 23:59:59,0.0,0.0,17115,1,17115,50.0,855800.0,0.0,True
6/14/09,2009-06-14 23:59:59,0.0,0.0,17187,1,17187,50.0,859400.0,0.0,True
6/15/09,2009-06-15 23:59:59,0.0,0.0,17271,1,17271,50.0,863600.0,0.0,True
6/16/09,2009-06-16 23:59:59,0.0,0.0,17342,1,17342,50.0,867150.0,0.0,True
6/17/09,2009-06-17 23:59:59,0.0,0.0,17421,1,17421,50.0,871100.0,0.0,True
6/18/09,2009-06-18 23:59:59,0.0,0.0,17501,1,17501,50.0,875100.0,0.0,True
6/19/09,2009-06-19 23:59:59,0.0,0.0,17588,1,17588,50.0,879450.0,0.0,True
6/20/09,2009-06-20 23:59:59,0.0,0.0,17666,1,17666,50.0,883350.0,0.0,True
6/21/09,2009-06-21 23:59:59,0.0,0.0,17747,1,17747,50.0,887400.0,0.0,True
6/22/09,2009-06-22 23:59:59,0.0,0.0,17823,1,17823,50.0,891200.0,0.0,True
6/23/09,2009-06-23 23:59:59,0.0,0.0,17899,1,17899,50.0,895000.0,0.0,True
6/24/09,2009-06-24 23:59:59,0.0,0.0,17994,1,17994,50.0,899750.0,0.0,True
6/25/09,2009-06-25 23:59:59,0.0,0.0,18062,1,18062,50.0,903150.0,0.0,True
6/26/09,2009-06-26 23:59:59,0.0,0.0,18152,1,18152,50.0,907650.0,0.0,True
6/27/09,2009-06-27 23:59:59,0.0,0.0,18236,1,18236,50.0,911850.0,0.0,True
6/28/09,2009-06-28 23:59:59,0.0,0.0,18282,1,18282,50.0,914150.0,0.0,True
6/29/09,2009-06-29 23:59:59,0.0,0.0,18365,1,18365,50.0,918300.0,0.0,True
6/30/09,2009-06-30 23:59:59,0.0,0.0,18450,1,18450,50.0,922550.0,0.0,True
7/1/09,2009-07-01 23:59:59,0.0,0.0,18524,1,18524,50.0,926250.0,0.0,True
7/2/09,2009-07-02 23:59:59,0.0,0.0,18607,1,18607,50.0,930400.0,0.0,True
7/3/09,2009-07-03 23:59:59,0.0,0.0,18689,1,18689,50.0,934500.0,0.0,True
7/4/09,2009-07-04 23:59:59,0.0,0.0,18778,1,18778,50.0,938950.0,0.0,True
7/5/09,2009-07-05 23:59:59,0.0,0.0,18857,1,18857,50.0,942900.0,0.0,True
7/6/09,2009-07-06 23:59:59,0.0,0.0,18941,1,18941,50.0,947100.0,0.0,True
7/7/09,2009-07-07 23:59:59,0.0,0.0,19010,1,19010,50.0,950550.0,0.0,True
7/8/09,2009-07-08 23:59:59,0.0,0.0,19084,1,19084,50.0,954250.0,0.0,True
7/9/09,2009-07-09 23:59:59,0.0,0.0,19170,1,19170,50.0,958550.0,0.0,True
7/10/09,2009-07-10 23:59:59,0.0,0.0,19251,1,19251,50.0,962600.0,0.0,True
7/11/09,2009-07-11 23:59:59,0.0,0.0,19334,1,19334,50.0,966750.0,0.0,True
7/12/09,2009-07-12 23:59:59,0.0,0.0,19411,1,19411,50.0,970600.0,0.0,True
7/13/09,2009-07-13 23:59:59,0.0,0.0,19489,1,19489,50.0,974500.0,0.0,True
7/14/09,2009-07-14 23:59:59,0.0,0.0,19558,1,19558,50.0,977950.0,0.0,True
7/15/09,2009-07-15 23:59:59,0.0,0.0,19603,1,19603,50.0,980200.0,0.0,True
7/16/09,2009-07-16 23:59:59,0.0,0.0,19674,1,19674,50.0,983750.0,0.0,True
7/17/09,2009-07-17 23:59:59,0.0,0.0,19721,1,19721,50.0,986100.0,0.0,True
7/18/09,2009-07-18 23:59:59,0.0,0.0,19725,1,19725,50.0,986300.0,0.0,True
7/19/09,2009-07-19 23:59:59,0.0,0.0,19795,1,19795,50.0,989800.0,0.0,True
7/20/09,2009-07-20 23:59:59,0.0,0.0,19865,1,19865,50.0,993300.0,0.0,True
7/21/09,2009-07-21 23:59:59,0.0,0.0,19947,1,19947,50.0,997400.0,0.0,True
7/22/09,2009-07-22 23:59:59,0.0,0.0,20007,1,20007,50.0,1000400.0,0.0,True
7/23/09,2009-07-23 23:59:59,0.0,0.0,20083,1,20083,50.0,1004200.0,0.0,True
7/24/09,2009-07-24 23:59:59,0.0,0.0,20156,1,20156,50.0,1007850.0,0.0,True
7/25/09,2009-07-25 23:59:59,0.0,0.0,20188,1,20188,50.0,1009450.0,0.0,True
7/26/09,2009-07-26 23:59:59,0.0,0.0,20209,1,20209,50.0,1010500.0,0.0,True
7/27/09,2009-07-27 23:59:59,0.0,0.0,20283,1,20283,50.0,1014200.0,0.0,True
7/28/09,2009-07-28 23:59:59,0.0,0.0,20324,1,20324,50.0,1016250.0,0.0,True
7/29/09,2009-07-29 23:59:59,0.0,0.0,20343,1,20343,50.0,1017200.0,0.0,True
7/30/09,2009-07-30 23:59:59,0.0,0.0,20358,1,20358,50.0,1017950.0,0.0,True
7/31/09,2009-07-31 23:59:59,0.0,0.0,20375,1,20375,50.0,1018800.0,0.0,True
8/1/09,2009-08-01 23:59:59,0.0,0.0,20403,1,20403,50.0,1020200.0,0.0,True
8/2/09,2009-08-02 23:59:59,0.0,0.0,20426,1,20426,50.0,1021350.0,0.0,True
8/3/09,2009-08-03 23:59:59,0.0,0.0,20438,1,20438,50.0,1021950.0,0.0,True
8/4/09,2009-08-04 23:59:59,0.0,0.0,20519,1,20519,50.0,1026000.0,0.0,True
8/5/09,2009-08-05 23:59:59,0.0,0.0,20606,1,20606,50.0,1030350.0,0.0,True
8/6/09,2009-08-06 23:59:59,0.0,0.0,20696,1,20696,50.0,1034850.0,0.0,True
8/7/09,2009-08-07 23:59:59,0.0,0.0,20776,1,20776,50.0,1038850.0,0.0,True
8/8/09,2009-08-08 23:59:59,0.0,0.0,20856,1,20856,50.0,1042850.0,0.0,True
8/9/09,2009-08-09 23:59:59,0.0,0.0,20957,1,20957,50.0,1047900.0,0.0,True
8/10/09,2009-08-10 23:59:59,0.0,0.0,21032,1,21032,50.0,1051650.0,0.0,True
8/11/09,2009-08-11 23:59:59,0.0,0.0,21102,1,21102,50.0,1055150.0,0.0,True
8/12/09,2009-08-12 23:59:59,0.0,0.0,21165,1,21165,50.0,1058300.0,0.0,True
8/13/09,2009-08-13 23:59:59,0.0,0.0,21250,1,21250,50.0,1062550.0,0.0,True
8/14/09,2009-08-14 23:59:59,0.0,0.0,21313,1,21313,50.0,1065700.0,0.0,True
8/15/09,2009-08-15 23:59:59,0.0,0.0,21339,1,21339,50.0,1067000.0,0.0,True
8/16/09,2009-08-16 23:59:59,0.0,0.0,21358,1,21358,50.0,1067950.0,0.0,True
8/17/09,2009-08-17 23:59:59,0.0,0.0,21375,1,21375,50.0,1068800.0,0.0,True
8/18/09,2009-08-18 23:59:59,0.0,0.0,21385,1,21385,50.0,1069300.0,0.0,True
8/19/09,2009-08-19 23:59:59,0.0,0.0,21403,1,21403,50.0,1070200.0,0.0,True
8/20/09,2009-08-20 23:59:59,0.0,0.0,21425,1,21425,50.0,1071300.0,0.0,True
8/21/09,2009-08-21 23:59:59,0.0,0.0,21439,1,21439,50.0,1072000.0,0.0,True
8/22/09,2009-08-22 23:59:59,0.0,0.0,21446,1,21446,50.0,1072350.0,0.0,True
8/23/09,2009-08-23 23:59:59,0.0,0.0,21461,1,21461,50.0,1073100.0,0.0,True
8/24/09,2009-08-24 23:59:59,0.0,0.0,21476,1,21476,50.0,1073850.0,0.0,True
8/25/09,2009-08-25 23:59:59,0.0,0.0,21526,1,21526,50.0,1076350.0,0.0,True
8/26/09,2009-08-26 23:59:59,0.0,0.0,21574,1,21574,50.0,1078750.0,0.0,True
8/27/09,2009-08-27 23:59:59,0.0,0.0,21603,1,21603,50.0,1080200.0,0.0,True
8/28/09,2009-08-28 23:59:59,0.0,0.0,21678,1,21678,50.0,1083950.0,0.0,True
8/29/09,2009-08-29 23:59:59,0.0,0.0,21756,1,21756,50.0,1087850.0,0.0,True
8/30/09,2009-08-30 23:59:59,0.0,0.0,21853,1,21853,50.0,1092700.0,0.0,True
8/31/09,2009-08-31 23:59:59,0.0,0.0,21939,1,21939,50.0,1097000.0,0.0,True
9/1/09,2009-09-01 23:59:59,0.0,0.0,22017,1,22017,50.0,1100900.0,0.0,True
9/2/09,2009-09-02 23:59:59,0.0,0.0,22083,1,22083,50.0,1104200.0,0.0,True
9/3/09,2009-09-03 23:59:59,0.0,0.0,22144,1,22144,50.0,1107250.0,0.0,True
9/4/09,2009-09-04 23:59:59,0.0,0.0,22208,1,22208,50.0,1110450.0,0.0,True
9/5/09,2009-09-05 23:59:59,0.0,0.0,22284,1,22284,50.0,1114250.0,0.0,True
9/6/09,2009-09-06 23:59:59,0.0,0.0,22352,1,22352,50.0,1117650.0,0.0,True
9/7/09,2009-09-07 23:59:59,0.0,0.0,22430,1,22430,50.0,1121550.0,0.0,True
9/8/09,2009-09-08 23:59:59,0.0,0.0,22499,1,22499,50.0,1125000.0,0.0,True
9/9/09,2009-09-09 23:59:59,0.0,0.0,22553,1,22553,50.0,1127700.0,0.0,True
9/10/09,2009-09-10 23:59:59,0.0,0.0,22620,1,22620,50.0,1131050.0,0.0,True
9/11/09,2009-09-11 23:59:59,0.0,0.0,22687,1,22687,50.0,1134400.0,0.0,True
9/12/09,2009-09-12 23:59:59,0.0,0.0,22756,1,22756,50.0,1137850.0,0.0,True
9/13/09,2009-09-13 23:59:59,0.0,0.0,22831,1,22831,50.0,1141600.0,0.0,True
9/14/09,2009-09-14 23:59:59,0.0,0.0,22905,1,22905,50.0,1145300.0,0.0,True
9/15/09,2009-09-15 23:59:59,0.0,0.0,22949,1,22949,50.0,1147500.0,0.0,True
9/16/09,2009-09-16 23:59:59,0.0,0.0,23021,1,23021,50.0,1151100.0,0.0,True
9/17/09,2009-09-17 23:59:59,0.0,0.0,23105,1,23105,50.0,1155300.0,0.0,True
9/18/09,2009-09-18 23:59:59,0.0,0.0,23183,1,23183,50.0,1159200.0,0.0,True
9/19/09,2009-09-19 23:59:59,0.0,0.0,23257,1,23257,50.0,1162900.0,0.0,True
9/20/09,2009-09-20 23:59:59,0.0,0.0,23335,1,23335,50.0,1166800.0,0.0,True
9/21/09,2009-09-21 23:59:59,0.0,0.0,23404,1,23404,50.0,1170250.0,0.0,True
9/22/09,2009-09-22 23:59:59,0.0,0.0,23429,1,23429,50.0,1171500.0,0.0,True
9/23/09,2009-09-23 23:59:59,0.0,0.0,23465,1,23465,50.0,1173300.0,0.0,True
9/24/09,2009-09-24 23:59:59,0.0,0.0,23562,1,23562,50.0,1178150.0,0.0,True
9/25/09,2009-09-25 23:59:59,0.0,0.0,23653,1,23653,50.0,1182700.0,0.0,True
9/26/09,2009-09-26 23:59:59,0.0,0.0,23753,1,23753,50.0,1187700.0,0.0,True
9/27/09,2009-09-27 23:59:59,0.0,0.0,23840,1,23840,50.0,1192050.0,0.0,True
9/28/09,2009-09-28 23:59:59,0.0,0.0,23925,1,23925,50.0,1196300.0,0.0,True
9/29/09,2009-09-29 23:59:59,0.0,0.0,24013,1,24013,50.0,1200700.0,0.0,True
9/30/09,2009-09-30 23:59:59,0.0,0.0,24098,1,24098,50.0,1204950.0,0.0,True
10/1/09,2009-10-01 23:59:59,0.0,0.0,24180,1,24180,50.0,1209050.0,0.0,True
10/2/09,2009-10-02 23:59:59,0.0,0.0,24252,1,24252,50.0,1212650.0,0.0,True
10/3/09,2009-10-03 23:59:59,0.0,0.0,24310,1,24310,50.0,1215550.0,0.0,True
10/4/09,2009-10-04 23:59:59,0.0,0.0,24363,1,24363,50.0,1218200.0,0.0,True
10/5/09,2009-10-05 23:59:59,0.00076392,0.0,24418,1,24418,50.0,1220950.0,932.708124,True
10/6/09,2009-10-06 23:59:59,0.000885,0.00076392,24461,1,24461,50.0,1223100.0,1082.4435,True
10/7/09,2009-10-07 23:59:59,0.00105,0.000885,24521,1,24521,50.0,1226100.0,1287.405,True
10/8/09,2009-10-08 23:59:59,0.001084,0.00105,24591,1,24591,50.0,1229600.0,1332.8863999999999,True
10/9/09,2009-10-09 23:59:59,0.0012,0.001084,24671,1,24671,50.0,1233600.0,1480.32,True
10/10/09,2009-10-10 23:59:59,0.00112,0.0012,24747,1,24747,50.0,1237400.0,1385.888,True
10/11/09,2009-10-11 23:59:59,0.001153,0.00112,24821,1,24821,50.0,1241100.0,1430.9883,True
10/12/09,2009-10-12 23:59:59,0.001102,0.001153,24879,1,24879,50.0,1244000.0,1370.888,True
10/13/09,2009-10-13 23:59:59,0.001129,0.001102,24936,1,24936,50.0,1246850.0,1407.69365,True
10/14/09,2009-10-14 23:59:59,0.001136,0.001129,25005,1,25005,50.0,1250300.0,1420.3408000000002,True
10/15/09,2009-10-15 23:59:59,0.00117,0.001136,25076,1,25076,50.0,1253850.0,1467.0045,True
10/16/09,2009-10-16 23:59:59,0.001245,0.00117,25136,1,25136,50.0,1256850.0,1564.77825,True
10/17/09,2009-10-17 23:59:59,0.001241,0.001245,25193,1,25193,50.0,1259700.0,1563.2876999999999,True
10/18/09,2009-10-18 23:59:59,0.001225,0.001241,25267,1,25267,50.0,1263400.0,1547.665,True
10/19/09,2009-10-19 23:59:59,0.001248,0.001225,25379,1,25379,50.0,1269000.0,1583.712,True
10/20/09,2009-10-20 23:59:59,0.001233,0.001248,25474,1,25474,50.0,1273750.0,1570.5337499999998,True
10/21/09,2009-10-21 23:59:59,0.001211,0.001233,25554,1,25554,50.0,1277750.0,1547.35525,True
10/22/09,2009-10-22 23:59:59,0.00122,0.001211,25644,1,25644,50.0,1282250.0,1564.345,True
10/23/09,2009-10-23 23:59:59,0.001257,0.00122,25733,1,25733,50.0,1286700.0,1617.3819,True
10/24/09,2009-10-24 23:59:59,0.001273,0.001257,25795,1,25795,50.0,1289800.0,1641.9154,True
10/25/09,2009-10-25 23:59:59,0.001288,0.001273,25871,1,25871,50.0,1293600.0,1666.1568000000002,True
10/26/09,2009-10-26 23:59:59,0.001266,0.001288,25942,1,25942,50.0,1297150.0,1642.1919,True
10/27/09,2009-10-27 23:59:59,0.001263,0.001266,26006,1,26006,50.0,1300350.0,1642.34205,True
10/28/09,2009-10-28 23:59:59,0.001285,0.001263,26072,1,26072,50.0,1303650.0,1675.1902499999999,True
10/29/09,2009-10-29 23:59:59,0.001266,0.001285,26118,1,26118,50.0,1305950.0,1653.3327,True
10/30/09,2009-10-30 23:59:59,0.001256,0.001266,26178,1,26178,50.0,1308950.0,1644.0412,True
10/31/09,2009-10-31 23:59:59,0.001247,0.001256,26224,1,26224,50.0,1311250.0,1635.12875,True
11/1/09,2009-11-01 23:59:59,0.001219,0.001247,26249,1,26249,50.0,1312500.0,1599.9375,True
11/2/09,2009-11-02 23:59:59,0.001256,0.001219,26282,1,26282,50.0,1314150.0,1650.5724,True
11/3/09,2009-11-03 23:59:59,0.001273,0.001256,26344,1,26344,50.0,1317250.0,1676.85925,True
11/4/09,2009-11-04 23:59:59,0.001306,0.001273,26407,1,26407,50.0,1320400.0,1724.4424000000001,True
11/5/09,2009-11-05 23:59:59,0.001306,0.001306,26464,1,26464,50.0,1323250.0,1728.1645,True
11/6/09,2009-11-06 23:59:59,0.001286,0.001306,26526,1,26526,50.0,1326350.0,1705.6861000000001,True
11/7/09,2009-11-07 23:59:59,0.00128,0.001286,26595,1,26595,50.0,1329800.0,1702.1440000000002,True
11/8/09,2009-11-08 23:59:59,0.00126,0.00128,26668,1,26668,50.0,1333450.0,1680.1470000000002,True
11/9/09,2009-11-09 23:59:59,0.00126,0.00126,26732,1,26732,50.0,1336650.0,1684.179,True
11/10/09,2009-11-10 23:59:59,0.001236,0.00126,26810,1,26810,50.0,1340550.0,1656.9198,True
11/11/09,2009-11-11 23:59:59,0.001299,0.001236,26874,1,26874,50.0,1343750.0,1745.53125,True
11/12/09,2009-11-12 23:59:59,0.001341,0.001299,26940,1,26940,50.0,1347050.0,1806.3940499999999,True
11/13/09,2009-11-13 23:59:59,0.001355,0.001341,27020,1,27020,50.0,1351050.0,1830.6727500000002,True
11/14/09,2009-11-14 23:59:59,0.001286,0.001355,27099,1,27099,50.0,1355000.0,1742.53,True
11/15/09,2009-11-15 23:59:59,0.001236,0.001286,27195,1,27195,50.0,1359800.0,1680.7127999999998,True
11/16/09,2009-11-16 23:59:59,0.001189,0.001236,27292,1,27292,50.0,1364650.0,1622.5688499999999,True
11/17/09,2009-11-17 23:59:59,0.001178,0.001189,27384,1,27384,50.0,1369250.0,1612.9765,True
11/18/09,2009-11-18 23:59:59,0.001106,0.001178,27463,1,27463,50.0,1373200.0,1518.7592,True
11/19/09,2009-11-19 23:59:59,0.001073,0.001106,27533,1,27533,50.0,1376700.0,1477.1991,True
11/20/09,2009-11-20 23:59:59,0.001077,0.001073,27619,1,27619,50.0,1381000.0,1487.337,True
11/21/09,2009-11-21 23:59:59,0.001064,0.001077,27692,1,27692,50.0,1384650.0,1473.2676000000001,True
11/22/09,2009-11-22 23:59:59,0.001059,0.001064,27798,1,27798,50.0,1389950.0,1471.95705,True
11/23/09,2009-11-23 23:59:59,0.001,0.001059,27894,1,27894,50.0,1394750.0,1394.75,True
11/24/09,2009-11-24 23:59:59,0.000927,0.001,27987,1,27987,50.0,1399400.0,1297.2438,True
11/25/09,2009-11-25 23:59:59,0.0009,0.000927,28077,1,28077,50.0,1403900.0,1263.51,True
11/26/09,2009-11-26 23:59:59,0.000897,0.0009,28161,1,28161,50.0,1408100.0,1263.0657,True
11/27/09,2009-11-27 23:59:59,0.00086,0.000897,28235,1,28235,50.0,1411800.0,1214.148,True
11/28/09,2009-11-28 23:59:59,0.000849,0.00086,28306,1,28306,50.0,1415350.0,1201.6321500000001,True
11/29/09,2009-11-29 23:59:59,0.000829,0.000849,28366,1,28366,50.0,1418350.0,1175.81215,True
11/30/09,2009-11-30 23:59:59,0.000824,0.000829,28441,1,28441,50.0,1422100.0,1171.8104,True
12/1/09,2009-12-01 23:59:59,0.000811,0.000824,28514,1,28514,50.0,1425750.0,1156.28325,True
12/2/09,2009-12-02 23:59:59,0.000795,0.000811,28608,1,28608,50.0,1430450.0,1137.20775,True
12/3/09,2009-12-03 23:59:59,0.000771,0.000795,28696,1,28696,50.0,1434850.0,1106.26935,True
12/4/09,2009-12-04 23:59:59,0.000746,0.000771,28732,1,28732,50.0,1436650.0,1071.7409,True
12/5/09,2009-12-05 23:59:59,0.000748,0.000746,28796,1,28796,50.0,1439850.0,1077.0077999999999,True
12/6/09,2009-12-06 23:59:59,0.000733,0.000748,28899,1,28899,50.0,1445000.0,1059.185,True
12/7/09,2009-12-07 23:59:59,0.000718,0.000733,29011,1,29011,50.0,1450600.0,1041.5308,True
12/8/09,2009-12-08 23:59:59,0.0007,0.000718,29116,1,29116,50.0,1455850.0,1019.095,True
12/9/09,2009-12-09 23:59:59,0.000687,0.0007,29212,1,29212,50.0,1460650.0,1003.46655,True
12/10/09,2009-12-10 23:59:59,0.00067,0.000687,29316,1,29316,50.0,1465850.0,982.1195,True
12/11/09,2009-12-11 23:59:59,0.000665,0.00067,29428,1,29428,50.0,1471450.0,978.5142500000001,True
12/12/09,2009-12-12 23:59:59,0.00064,0.000665,29538,1,29538,50.0,1476950.0,945.248,True
12/13/09,2009-12-13 23:59:59,0.000618,0.00064,29652,1,29652,50.0,1482650.0,916.2777,True
12/14/09,2009-12-14 23:59:59,0.000615,0.000618,29754,1,29754,50.0,1487750.0,914.96625,True
12/15/09,2009-12-15 23:59:59,0.000615,0.000615,29864,1,29864,50.0,1493250.0,918.34875,True
12/16/09,2009-12-16 23:59:59,0.000622,0.000615,30000,1,30000,50.0,1500050.0,933.0311,True
12/17/09,2009-12-17 23:59:59,0.000613,0.000622,30169,1,30169,50.0,1508500.0,924.7105,True
12/18/09,2009-12-18 23:59:59,0.000616,0.000613,30394,1,30394,50.0,1519750.0,936.166,True
12/19/09,2009-12-19 23:59:59,0.00063,0.000616,30592,1,30592,50.0,1529650.0,963.6795000000001,True
12/20/09,2009-12-20 23:59:59,0.000627,0.00063,30767,1,30767,50.0,1538400.0,964.5767999999999,True
12/21/09,2009-12-21 23:59:59,0.000627,0.000627,30942,1,30942,50.0,1547150.0,970.06305,True
12/22/09,2009-12-22 23:59:59,0.000633,0.000627,31104,1,31104,50.0,1555250.0,984.47325,True
12/23/09,2009-12-23 23:59:59,0.000633,0.000633,31258,1,31258,50.0,1562950.0,989.34735,True
12/24/09,2009-12-24 23:59:59,0.000633,0.000633,31412,1,31412,50.0,1570650.0,994.22145,True
12/25/09,2009-12-25 23:59:59,0.000633,0.000633,31561,1,31561,50.0,1578100.0,998.9372999999999,True
12/26/09,2009-12-26 23:59:59,0.000633,0.000633,31735,1,31735,50.0,1586800.0,1004.4444,True
12/27/09,2009-12-27 23:59:59,0.000633,0.000633,31902,1,31902,50.0,1595150.0,1009.72995,True
12/28/09,2009-12-28 23:59:59,0.000633,0.000633,32039,1,32039,50.0,1602000.0,1014.066,True
12/29/09,2009-12-29 23:59:59,0.000633,0.000633,32210,1,32210,50.0,1610550.0,1019.47815,True
12/30/09,2009-12-30 23:59:59,0.000643,0.000633,32351,1,32351,50.0,1617600.0,1040.1168,True
12/31/09,2009-12-31 23:59:59,0.000689,0.000643,32489,1,32489,50.0,1624500.0,1119.2805,True
1/1/10,2010-01-01 23:59:59,0.000718,0.000689,32622,1,32622,50.0,1631150.0,1171.1657,True
1/2/10,2010-01-02 23:59:59,0.000718,0.000718,32747,1,32747,50.0,1637400.0,1175.6532,True
1/3/10,2010-01-03 23:59:59,0.000718,0.000718,32933,1,32933,50.0,1646700.0,1182.3306,True
1/4/10,2010-01-04 23:59:59,0.000718,0.000718,33114,1,33114,50.0,1655750.0,1188.8285,True
1/5/10,2010-01-05 23:59:59,0.000718,0.000718,33312,1,33312,50.0,1665650.0,1195.9367,True
1/6/10,2010-01-06 23:59:59,0.000718,0.000718,33475,1,33475,50.0,1673800.0,1201.7884,True
1/7/10,2010-01-07 23:59:59,0.000718,0.000718,33629,1,33629,50.0,1681500.0,1207.317,True
1/8/10,2010-01-08 23:59:59,0.000718,0.000718,33782,1,33782,50.0,1689150.0,1212.8097,True
1/9/10,2010-01-09 23:59:59,0.000718,0.000718,33933,1,33933,50.0,1696700.0,1218.2306,True
1/10/10,2010-01-10 23:59:59,0.000718,0.000718,34123,1,34123,50.0,1706200.0,1225.0516,True
1/11/10,2010-01-11 23:59:59,0.000718,0.000718,34282,1,34282,50.0,1714150.0,1230.7597,True
1/12/10,2010-01-12 23:59:59,0.000718,0.000718,34441,1,34441,50.0,1722100.0,1236.4678,True
1/13/10,2010-01-13 23:59:59,0.000718,0.000718,34605,1,34605,50.0,1730300.0,1242.3554,True
1/14/10,2010-01-14 23:59:59,0.000718,0.000718,34748,1,34748,50.0,1737450.0,1247.4891,True
1/15/10,2010-01-15 23:59:59,0.000718,0.000718,34889,1,34889,50.0,1744500.0,1252.551,True
1/16/10,2010-01-16 23:59:59,0.002831,0.000718,35014,1,35014,50.0,1750750.0,4956.373250000001,True
1/17/10,2010-01-17 23:59:59,0.0028,0.002831,35145,1,35145,50.0,1757300.0,4920.44,True
1/18/10,2010-01-18 23:59:59,0.002946,0.0028,35270,1,35270,50.0,1763550.0,5195.418299999999,True
1/19/10,2010-01-19 23:59:59,0.002736,0.002946,35394,1,35394,50.0,1769750.0,4842.036,True
1/20/10,2010-01-20 23:59:59,0.002919,0.002736,35552,1,35552,50.0,1777650.0,5188.96035,True
1/21/10,2010-01-21 23:59:59,0.002893,0.002919,35727,1,35727,50.0,1786400.0,5168.055200000001,True
1/22/10,2010-01-22 23:59:59,0.003048,0.002893,35860,1,35860,50.0,1793050.0,5465.2164,True
1/23/10,2010-01-23 23:59:59,0.003211,0.003048,36020,1,36020,50.0,1801050.0,5783.17155,True
1/24/10,2010-01-24 23:59:59,0.003252,0.003211,36174,1,36174,50.0,1808750.0,5882.055,True
1/25/10,2010-01-25 23:59:59,0.003254,0.003252,36385,1,36385,50.0,1819300.0,5920.0022,True
1/26/10,2010-01-26 23:59:59,0.003366,0.003254,36580,1,36580,50.0,1829050.0,6156.5823,True
1/27/10,2010-01-27 23:59:59,0.003185,0.003366,36744,1,36744,50.0,1837250.0,5851.64125,True
1/28/10,2010-01-28 23:59:59,0.003281,0.003185,36921,1,36921,50.0,1846100.0,6057.0541,True
1/29/10,2010-01-29 23:59:59,0.003259,0.003281,37118,1,37118,50.0,1855950.0,6048.541050000001,True
1/30/10,2010-01-30 23:59:59,0.003241,0.003259,37328,1,37328,50.0,1866450.0,6049.16445,True
1/31/10,2010-01-31 23:59:59,0.003298,0.003241,37493,1,37493,50.0,1874700.0,6182.7606000000005,True
2/1/10,2010-02-01 23:59:59,0.003297,0.003298,37677,1,37677,50.0,1883900.0,6211.2183,True
2/2/10,2010-02-02 23:59:59,0.003364,0.003297,37822,1,37822,50.0,1891150.0,6361.8286,True
2/3/10,2010-02-03 23:59:59,0.003496,0.003364,38092,1,38092,50.0,1904650.0,6658.6564,True
2/4/10,2010-02-04 23:59:59,0.00357,0.003496,38321,1,38321,50.0,1916100.0,6840.477,True
2/5/10,2010-02-05 23:59:59,0.003658,0.00357,38544,1,38544,50.0,1927250.0,7049.880499999999,True
2/6/10,2010-02-06 23:59:59,0.003672,0.003658,38736,1,38736,50.0,1936850.0,7112.1132,True
2/7/10,2010-02-07 23:59:59,0.003735,0.003672,38953,1,38953,50.0,1947700.0,7274.6595,True
2/8/10,2010-02-08 23:59:59,0.003795,0.003735,39153,1,39153,50.0,1957700.0,7429.471500000001,True
2/9/10,2010-02-09 23:59:59,0.003803,0.003795,39360,1,39360,50.0,1968050.0,7484.4941499999995,True
2/10/10,2010-02-10 23:59:59,0.003857,0.003803,39528,1,39528,50.0,1976450.0,7623.16765,True
2/11/10,2010-02-11 23:59:59,0.003847,0.003857,39697,1,39697,50.0,1984900.0,7635.9103000000005,True
2/12/10,2010-02-12 23:59:59,0.003911,0.003847,39880,1,39880,50.0,1994050.0,7798.729550000001,True
2/13/10,2010-02-13 23:59:59,0.004005,0.003911,40112,1,40112,50.0,2005650.0,8032.62825,True
2/14/10,2010-02-14 23:59:59,0.004052,0.004005,40320,1,40320,50.0,2016050.0,8169.0346,True
2/15/10,2010-02-15 23:59:59,0.004147,0.004052,40496,1,40496,50.0,2024850.0,8397.05295,True
2/16/10,2010-02-16 23:59:59,0.004203,0.004147,40691,1,40691,50.0,2034600.0,8551.4238,True
2/17/10,2010-02-17 23:59:59,0.004261,0.004203,40930,1,40930,50.0,2046550.0,8720.34955,True
2/18/10,2010-02-18 23:59:59,0.004307,0.004261,41138,1,41138,50.0,2056950.0,8859.28365,True
2/19/10,2010-02-19 23:59:59,0.004415,0.004307,41330,1,41330,50.0,2066550.0,9123.818249999998,True
2/20/10,2010-02-20 23:59:59,0.004559,0.004415,41538,1,41538,50.0,2076950.0,9468.81505,True
2/21/10,2010-02-21 23:59:59,0.004662,0.004559,41761,1,41761,50.0,2088100.0,9734.7222,True
2/22/10,2010-02-22 23:59:59,0.004706,0.004662,42021,1,42021,50.0,2101100.0,9887.776600000001,True
2/23/10,2010-02-23 23:59:59,0.00485,0.004706,42271,1,42271,50.0,2113600.0,10250.960000000001,True
2/24/10,2010-02-24 23:59:59,0.004975,0.00485,42442,1,42442,50.0,2122150.0,10557.69625,True
2/25/10,2010-02-25 23:59:59,0.005029,0.004975,42596,1,42596,50.0,2129850.0,10711.01565,True
2/26/10,2010-02-26 23:59:59,0.005104,0.005029,42768,1,42768,50.0,2138450.0,10914.6488,True
2/27/10,2010-02-27 23:59:59,0.005168,0.005104,42940,1,42940,50.0,2147050.0,11095.9544,True
2/28/10,2010-02-28 23:59:59,0.005298,0.005168,43096,1,43096,50.0,2154850.0,11416.3953,True
3/1/10,2010-03-01 23:59:59,0.005397,0.005298,43291,1,43291,50.0,2164600.0,11682.3462,True
3/2/10,2010-03-02 23:59:59,0.005472,0.005397,43479,1,43479,50.0,2174000.0,11896.128,True
3/3/10,2010-03-03 23:59:59,0.005472,0.005472,43631,1,43631,50.0,2181600.0,11937.7152,True
3/4/10,2010-03-04 23:59:59,0.005472,0.005472,43816,1,43816,50.0,2190850.0,11988.3312,True
3/5/10,2010-03-05 23:59:59,0.005472,0.005472,43987,1,43987,50.0,2199400.0,12035.1168,True
3/6/10,2010-03-06 23:59:59,0.005472,0.005472,44164,1,44164,50.0,2208250.0,12083.544,True
3/7/10,2010-03-07 23:59:59,0.005472,0.005472,44343,1,44343,50.0,2217200.0,12132.5184,True
3/8/10,2010-03-08 23:59:59,0.005472,0.005472,44468,1,44468,50.0,2223450.0,12166.718400000002,True
3/9/10,2010-03-09 23:59:59,0.005472,0.005472,44614,1,44614,50.0,2230750.0,12206.664,True
3/10/10,2010-03-10 23:59:59,0.005472,0.005472,44776,1,44776,50.0,2238850.0,12250.987200000001,True
3/11/10,2010-03-11 23:59:59,0.005472,0.005472,44909,1,44909,50.0,2245500.0,12287.376,True
3/12/10,2010-03-12 23:59:59,0.005472,0.005472,45030,1,45030,50.0,2251550.0,12320.481600000001,True
3/13/10,2010-03-13 23:59:59,0.005472,0.005472,45183,1,45183,50.0,2259200.0,12362.342400000001,True
3/14/10,2010-03-14 23:59:59,0.005472,0.005472,45308,1,45308,50.0,2265450.0,12396.5424,True
3/15/10,2010-03-15 23:59:59,0.005472,0.005472,45443,1,45443,50.0,2272200.0,12433.4784,True
3/16/10,2010-03-16 23:59:59,0.005472,0.005472,45569,1,45569,50.0,2278500.0,12467.952000000001,True
3/17/10,2010-03-17 23:59:59,0.005472,0.005472,45705,1,45705,50.0,2285300.0,12505.161600000001,True
3/18/10,2010-03-18 23:59:59,0.005472,0.005472,45845,1,45845,50.0,2292300.0,12543.465600000001,True
3/19/10,2010-03-19 23:59:59,0.005472,0.005472,45998,1,45998,50.0,2299950.0,12585.3264,True
3/20/10,2010-03-20 23:59:59,0.005472,0.005472,46190,1,46190,50.0,2309550.0,12637.857600000001,True
3/21/10,2010-03-21 23:59:59,0.005472,0.005472,46373,1,46373,50.0,2318700.0,12687.9264,True
3/22/10,2010-03-22 23:59:59,0.005472,0.005472,46552,1,46552,50.0,2327650.0,12736.900800000001,True
3/23/10,2010-03-23 23:59:59,0.005472,0.005472,46759,1,46759,50.0,2338000.0,12793.536,True
3/24/10,2010-03-24 23:59:59,0.005472,0.005472,46930,1,46930,50.0,2346550.0,12840.321600000001,True
3/25/10,2010-03-25 23:59:59,0.005472,0.005472,47117,1,47117,50.0,2355900.0,12891.4848,True
3/26/10,2010-03-26 23:59:59,0.005472,0.005472,47314,1,47314,50.0,2365750.0,12945.384,True
3/27/10,2010-03-27 23:59:59,0.005472,0.005472,47492,1,47492,50.0,2374650.0,12994.0848,True
3/28/10,2010-03-28 23:59:59,0.005472,0.005472,47678,1,47678,50.0,2383950.0,13044.974400000001,True
3/29/10,2010-03-29 23:59:59,0.005472,0.005472,47873,1,47873,50.0,2393700.0,13098.3264,True
3/30/10,2010-03-30 23:59:59,0.005472,0.005472,48088,1,48088,50.0,2404450.0,13157.1504,True
3/31/10,2010-03-31 23:59:59,0.005472,0.005472,48297,1,48297,50.0,2414900.0,13214.3328,True
4/1/10,2010-04-01 23:59:59,0.005472,0.005472,48465,1,48465,50.0,2423300.0,13260.2976,True
4/2/10,2010-04-02 23:59:59,0.005472,0.005472,48621,1,48621,50.0,2431100.0,13302.979200000002,True
4/3/10,2010-04-03 23:59:59,0.005472,0.005472,48782,1,48782,50.0,2439150.0,13347.0288,True
4/4/10,2010-04-04 23:59:59,0.005472,0.005472,48953,1,48953,50.0,2447700.0,13393.814400000001,True
4/5/10,2010-04-05 23:59:59,0.005472,0.005472,49106,1,49106,50.0,2455350.0,13435.675200000001,True
4/6/10,2010-04-06 23:59:59,0.005472,0.005472,49265,1,49265,50.0,2463300.0,13479.1776,True
4/7/10,2010-04-07 23:59:59,0.005472,0.005472,49458,1,49458,50.0,2472950.0,13531.9824,True
4/8/10,2010-04-08 23:59:59,0.005472,0.005472,49641,1,49641,50.0,2482100.0,13582.0512,True
4/9/10,2010-04-09 23:59:59,0.005472,0.005472,49830,1,49830,50.0,2491550.0,13633.761600000002,True
4/10/10,2010-04-10 23:59:59,0.005472,0.005472,50090,1,50090,50.0,2504550.0,13704.8976,True
4/11/10,2010-04-11 23:59:59,0.005472,0.005472,50313,1,50313,50.0,2515700.0,13765.9104,True
4/12/10,2010-04-12 23:59:59,0.005472,0.005472,50516,1,50516,50.0,2525850.0,13821.451200000001,True
4/13/10,2010-04-13 23:59:59,0.005472,0.005472,50705,1,50705,50.0,2535300.0,13873.161600000001,True
4/14/10,2010-04-14 23:59:59,0.005472,0.005472,50885,1,50885,50.0,2544300.0,13922.4096,True
4/15/10,2010-04-15 23:59:59,0.005472,0.005472,51101,1,51101,50.0,2555100.0,13981.5072,True
4/16/10,2010-04-16 23:59:59,0.005472,0.005472,51303,1,51303,50.0,2565200.0,14036.7744,True
4/17/10,2010-04-17 23:59:59,0.005472,0.005472,51524,1,51524,50.0,2576250.0,14097.240000000002,True
4/18/10,2010-04-18 23:59:59,0.005472,0.005472,51769,1,51769,50.0,2588500.0,14164.272,True
4/19/10,2010-04-19 23:59:59,0.005472,0.005472,52001,1,52001,50.0,2600100.0,14227.747200000002,True
4/20/10,2010-04-20 23:59:59,0.005472,0.005472,52206,1,52206,50.0,2610350.0,14283.835200000001,True
4/21/10,2010-04-21 23:59:59,0.005472,0.005472,52425,1,52425,50.0,2621300.0,14343.7536,True
4/22/10,2010-04-22 23:59:59,0.005472,0.005472,52584,1,52584,50.0,2629250.0,14387.256000000001,True
4/23/10,2010-04-23 23:59:59,0.005472,0.005472,52734,1,52734,50.0,2636750.0,14428.296,True
4/24/10,2010-04-24 23:59:59,0.005472,0.005472,52902,1,52902,50.0,2645150.0,14474.2608,True
4/25/10,2010-04-25 23:59:59,0.003,0.005472,53060,1,53060,50.0,2653050.0,7959.150000000001,True
4/26/10,2010-04-26 23:59:59,0.003,0.003,53224,1,53224,50.0,2661250.0,7983.75,True
4/27/10,2010-04-27 23:59:59,0.003,0.003,53404,1,53404,50.0,2670250.0,8010.75,True
4/28/10,2010-04-28 23:59:59,0.003,0.003,53584,1,53584,50.0,2679250.0,8037.75,True
4/29/10,2010-04-29 23:59:59,0.003,0.003,53731,1,53731,50.0,2686600.0,8059.8,True
4/30/10,2010-04-30 23:59:59,0.003,0.003,53875,1,53875,50.0,2693800.0,8081.400000000001,True
5/1/10,2010-05-01 23:59:59,0.003,0.003,54058,1,54058,50.0,2702950.0,8108.85,True
5/2/10,2010-05-02 23:59:59,0.003,0.003,54213,1,54213,50.0,2710700.0,8132.1,True
5/3/10,2010-05-03 23:59:59,0.003,0.003,54372,1,54372,50.0,2718650.0,8155.95,True
5/4/10,2010-05-04 23:59:59,0.003,0.003,54508,1,54508,50.0,2725450.0,8176.35,True
5/5/10,2010-05-05 23:59:59,0.003284,0.003,54645,1,54645,50.0,2732300.0,8972.8732,True
5/6/10,2010-05-06 23:59:59,0.004014,0.003284,54794,1,54794,50.0,2739750.0,10997.3565,True
5/7/10,2010-05-07 23:59:59,0.004206,0.004014,54926,1,54926,50.0,2746350.0,11551.148099999999,True
5/8/10,2010-05-08 23:59:59,0.003499,0.004206,55080,1,55080,50.0,2754050.0,9636.42095,True
5/9/10,2010-05-09 23:59:59,0.003499,0.003499,55223,1,55223,50.0,2761200.0,9661.4388,True
5/10/10,2010-05-10 23:59:59,0.0039,0.003499,55351,1,55351,50.0,2767600.0,10793.64,True
5/11/10,2010-05-11 23:59:59,0.004043,0.0039,55462,1,55462,50.0,2773150.0,11211.845449999999,True
5/12/10,2010-05-12 23:59:59,0.004376,0.004043,55589,1,55589,50.0,2779500.0,12163.091999999999,True
5/13/10,2010-05-13 23:59:59,0.004376,0.004376,55717,1,55717,50.0,2785900.0,12191.098399999999,True
5/14/10,2010-05-14 23:59:59,0.004,0.004376,55840,1,55840,50.0,2792050.0,11168.2,True
5/15/10,2010-05-15 23:59:59,0.004,0.004,55931,1,55931,50.0,2796600.0,11186.4,True
5/16/10,2010-05-16 23:59:59,0.004,0.004,56044,1,56044,50.0,2802250.0,11209.0,True
5/17/10,2010-05-17 23:59:59,0.004,0.004,56187,1,56187,50.0,2809400.0,11237.6,True
5/18/10,2010-05-18 23:59:59,0.004647,0.004,56355,1,56355,50.0,2817800.0,13094.3166,True
5/19/10,2010-05-19 23:59:59,0.004571,0.004647,56519,1,56519,50.0,2826000.0,12917.646,True
5/20/10,2010-05-20 23:59:59,0.0045,0.004571,56722,1,56722,50.0,2836150.0,12762.675,True
5/21/10,2010-05-21 23:59:59,0.0045,0.0045,56898,1,56898,50.0,2844950.0,12802.275,True
5/22/10,2010-05-22 23:59:59,0.004473,0.0045,57093,1,57093,50.0,2854700.0,12769.073100000001,True
5/23/10,2010-05-23 23:59:59,0.0047,0.004473,57304,1,57304,50.0,2865250.0,13466.675000000001,True
5/24/10,2010-05-24 23:59:59,0.0047,0.0047,57492,1,57492,50.0,2874650.0,13510.855000000001,True
5/25/10,2010-05-25 23:59:59,0.004845,0.0047,57702,1,57702,50.0,2885150.0,13978.55175,True
5/26/10,2010-05-26 23:59:59,0.004598,0.004845,57925,1,57925,50.0,2896300.0,13317.187399999999,True
5/27/10,2010-05-27 23:59:59,0.004598,0.004598,58117,1,58117,50.0,2905900.0,13361.328199999998,True
5/28/10,2010-05-28 23:59:59,0.004547,0.004598,58340,1,58340,50.0,2917050.0,13263.82635,True
5/29/10,2010-05-29 23:59:59,0.004485,0.004547,58524,1,58524,50.0,2926250.0,13124.23125,True
5/30/10,2010-05-30 23:59:59,0.004485,0.004485,58673,1,58673,50.0,2933700.0,13157.6445,True
5/31/10,2010-05-31 23:59:59,0.004485,0.004485,58815,1,58815,50.0,2940800.0,13189.488000000001,True
6/1/10,2010-06-01 23:59:59,0.004485,0.004485,58950,1,58950,50.0,2947550.0,13219.761750000001,True
6/2/10,2010-06-02 23:59:59,0.004485,0.004485,59097,1,59097,50.0,2954900.0,13252.7265,True
6/3/10,2010-06-03 23:59:59,0.004485,0.004485,59249,1,59249,50.0,2962500.0,13286.8125,True
6/4/10,2010-06-04 23:59:59,0.004485,0.004485,59374,1,59374,50.0,2968750.0,13314.84375,True
6/5/10,2010-06-05 23:59:59,0.004485,0.004485,59519,1,59519,50.0,2976000.0,13347.36,True
6/6/10,2010-06-06 23:59:59,0.004485,0.004485,59667,1,59667,50.0,2983400.0,13380.549,True
6/7/10,2010-06-07 23:59:59,0.004518,0.004485,59824,1,59824,50.0,2991250.0,13514.4675,True
6/8/10,2010-06-08 23:59:59,0.004518,0.004518,59984,1,59984,50.0,2999250.0,13550.6115,True
6/9/10,2010-06-09 23:59:59,0.004563,0.004518,60152,1,60152,50.0,3007650.0,13723.90695,True
6/10/10,2010-06-10 23:59:59,0.005,0.004563,60312,1,60312,50.0,3015650.0,15078.25,True
6/11/10,2010-06-11 23:59:59,0.005,0.005,60480,1,60480,50.0,3024050.0,15120.25,True
6/12/10,2010-06-12 23:59:59,0.005,0.005,60615,1,60615,50.0,3030800.0,15154.0,True
6/13/10,2010-06-13 23:59:59,0.005,0.005,60788,1,60788,50.0,3039450.0,15197.25,True
6/14/10,2010-06-14 23:59:59,0.005,0.005,60948,1,60948,50.0,3047450.0,15237.25,True
6/15/10,2010-06-15 23:59:59,0.005,0.005,61132,1,61132,50.0,3056650.0,15283.25,True
6/16/10,2010-06-16 23:59:59,0.005,0.005,61274,1,61274,50.0,3063750.0,15318.75,True
6/17/10,2010-06-17 23:59:59,0.005,0.005,61420,1,61420,50.0,3071050.0,15355.25,True
6/18/10,2010-06-18 23:59:59,0.004975,0.005,61570,1,61570,50.0,3078550.0,15315.786250000001,True
6/19/10,2010-06-19 23:59:59,0.004975,0.004975,61720,1,61720,50.0,3086050.0,15353.098750000001,True
6/20/10,2010-06-20 23:59:59,0.004975,0.004975,61905,1,61905,50.0,3095300.0,15399.1175,True
6/21/10,2010-06-21 23:59:59,0.004975,0.004975,62059,1,62059,50.0,3103000.0,15437.425000000001,True
6/22/10,2010-06-22 23:59:59,0.004975,0.004975,62215,1,62215,50.0,3110800.0,15476.230000000001,True
6/23/10,2010-06-23 23:59:59,0.004967,0.004975,62402,1,62402,50.0,3120150.0,15497.78505,True
6/24/10,2010-06-24 23:59:59,0.005181,0.004967,62571,1,62571,50.0,3128600.0,16209.2766,True
6/25/10,2010-06-25 23:59:59,0.005181,0.005181,62721,1,62721,50.0,3136100.0,16248.1341,True
6/26/10,2010-06-26 23:59:59,0.0044,0.005181,62880,1,62880,50.0,3144050.0,13833.820000000002,True
6/27/10,2010-06-27 23:59:59,0.0044,0.0044,63058,1,63058,50.0,3152950.0,13872.980000000001,True
6/28/10,2010-06-28 23:59:59,0.005328,0.0044,63210,1,63210,50.0,3160550.0,16839.4104,True
6/29/10,2010-06-29 23:59:59,0.005328,0.005328,63379,1,63379,50.0,3169000.0,16884.432,True
6/30/10,2010-06-30 23:59:59,0.0054,0.005328,63561,1,63561,50.0,3178100.0,17161.74,True
7/1/10,2010-07-01 23:59:59,0.006032,0.0054,63773,1,63773,50.0,3188700.0,19234.2384,True
7/2/10,2010-07-02 23:59:59,0.0055,0.006032,63939,1,63939,50.0,3197000.0,17583.5,True
7/3/10,2010-07-03 23:59:59,0.006409,0.0055,64151,1,64151,50.0,3207600.0,20557.5084,True
7/4/10,2010-07-04 23:59:59,0.006777,0.006409,64317,1,64317,50.0,3215900.0,21794.1543,True
7/5/10,2010-07-05 23:59:59,0.007153,0.006777,64499,1,64499,50.0,3225000.0,23068.425,True
7/6/10,2010-07-06 23:59:59,0.00575,0.007153,64665,1,64665,50.0,3233300.0,18591.475,True
7/7/10,2010-07-07 23:59:59,0.007893,0.00575,64821,1,64821,50.0,3241100.0,25582.002300000004,True
7/8/10,2010-07-08 23:59:59,0.00625,0.007893,64972,1,64972,50.0,3248650.0,20304.0625,True
7/9/10,2010-07-09 23:59:59,0.00625,0.00625,65171,1,65171,50.0,3258600.0,20366.25,True
7/10/10,2010-07-10 23:59:59,0.008099,0.00625,65369,1,65369,50.0,3268500.0,26471.5815,True
7/11/10,2010-07-11 23:59:59,0.007886,0.008099,65548,1,65548,50.0,3277450.0,25845.9707,True
7/12/10,2010-07-12 23:59:59,0.011933,0.007886,66207,1,66207,50.0,3310400.0,39503.0032,True
7/13/10,2010-07-13 23:59:59,0.016075,0.011933,66899,1,66899,50.0,3345000.0,53770.875,True
7/14/10,2010-07-14 23:59:59,0.019472,0.016075,67477,1,67477,50.0,3373900.0,65696.5808,True
7/15/10,2010-07-15 23:59:59,0.030863,0.019472,68103,1,68103,50.0,3405200.0,105094.6876,True
7/16/10,2010-07-16 23:59:59,0.060535,0.030863,68606,1,68606,50.0,3430350.0,207656.23725,True
7/17/10,2010-07-17 23:59:59,0.049510000000000005,0.060535,68779,1,68779,50.0,3439000.0,170264.89,True
7/18/10,2010-07-18 23:59:59,0.08584000000000001,0.08585000000000001,68951,1,68951,50.0,3447600.0,295941.98400000005,True
7/19/10,2010-07-19 23:59:59,0.08080000000000001,0.09307000000000001,69125,1,69125,50.0,3456300.0,279269.04000000004,True
7/20/10,2010-07-20 23:59:59,0.074733333333333,0.08181000000000001,69306,1,69306,50.0,3465350.0,258977.1566666655,True
7/21/10,2010-07-21 23:59:59,0.07921,0.07921,69513,1,69513,50.0,3475700.0,275310.197,True
7/22/10,2010-07-22 23:59:59,0.055944999999999995,0.08080000000000001,69689,1,69689,50.0,3484500.0,194940.35249999998,True
7/23/10,2010-07-23 23:59:59,0.062283333333333,0.06767000000000001,69883,1,69883,50.0,3494200.0,217630.42333333218,True
7/24/10,2010-07-24 23:59:59,0.054540000000000005,0.062283333333333,70072,1,70072,50.0,3503650.0,191089.07100000003,True
7/25/10,2010-07-25 23:59:59,0.0505,0.059410000000000004,70303,1,70303,50.0,3515200.0,177517.6,True
7/26/10,2010-07-26 23:59:59,0.056,0.056,70545,1,70545,50.0,3527300.0,197528.80000000002,True
7/27/10,2010-07-27 23:59:59,0.059844444444444006,0.059844444444444006,70712,1,70712,50.0,3535650.0,211589.00999999844,True
7/28/10,2010-07-28 23:59:59,0.0589,0.061,70870,1,70870,50.0,3543550.0,208715.095,True
7/29/10,2010-07-29 23:59:59,0.06920000000000001,0.0699,71051,1,71051,50.0,3552600.0,245839.92000000004,True
7/30/10,2010-07-30 23:59:59,0.064283333333333,0.0698,71233,1,71233,50.0,3561700.0,228957.94833333214,True
7/31/10,2010-07-31 23:59:59,0.06785000000000001,0.06888999999999901,71436,1,71436,50.0,3571850.0,242350.02250000002,True
8/1/10,2010-08-01 23:59:59,0.0611,0.06785000000000001,71675,1,71675,50.0,3583800.0,218970.18,True
8/2/10,2010-08-02 23:59:59,0.06,0.06330000000000001,71917,1,71917,50.0,3595900.0,215754.0,True
8/3/10,2010-08-03 23:59:59,0.06,0.065,72144,1,72144,50.0,3607250.0,216435.0,True
8/4/10,2010-08-04 23:59:59,0.05795,0.0623,72387,1,72387,50.0,3619400.0,209744.23,True
8/5/10,2010-08-05 23:59:59,0.061,0.061,72605,1,72605,50.0,3630300.0,221448.3,True
8/6/10,2010-08-06 23:59:59,0.0621,0.062400000000000004,72752,1,72752,50.0,3637650.0,225898.065,True
8/7/10,2010-08-07 23:59:59,0.059000000000000004,0.062200000000000005,72907,1,72907,50.0,3645400.0,215078.6,True
8/8/10,2010-08-08 23:59:59,0.0609,0.0609,73106,1,73106,50.0,3655350.0,222610.815,True
8/9/10,2010-08-09 23:59:59,0.07100000000000001,0.07350000000000001,73296,1,73296,50.0,3664850.0,260204.35000000003,True
8/10/10,2010-08-10 23:59:59,0.06,0.07100000000000001,73487,1,73487,50.0,3674400.0,220464.0,True
8/11/10,2010-08-11 23:59:59,0.067,0.07541,73720,1,73720,50.0,3686050.0,246965.35,True
8/12/10,2010-08-12 23:59:59,0.07,0.07,73937,1,73937,50.0,3696900.0,258783.00000000003,True
8/13/10,2010-08-13 23:59:59,0.0645,0.07,74152,1,74152,50.0,3707650.0,239143.42500000002,True
8/14/10,2010-08-14 23:59:59,0.067,0.06905800000000001,74433,1,74433,50.0,3721700.0,249353.90000000002,True
8/15/10,2010-08-15 23:59:59,0.06529,0.067,74640,1,74640,50.0,3732050.0,243665.5445,True
8/16/10,2010-08-16 23:59:59,0.0655,0.0679,74787,1,74787,50.0,3739400.0,244930.7,True
8/17/10,2010-08-17 23:59:59,0.07,0.07690000000000001,74916,1,74916,50.0,3745850.0,262209.5,True
8/18/10,2010-08-18 23:59:59,0.068,0.0733,75049,1,75049,50.0,3752500.0,255170.00000000003,True
8/19/10,2010-08-19 23:59:59,0.06670000000000001,0.068,75184,1,75184,50.0,3759250.0,250741.97500000003,True
8/20/10,2010-08-20 23:59:59,0.0655,0.06670000000000001,75377,1,75377,50.0,3768900.0,246862.95,True
8/21/10,2010-08-21 23:59:59,0.0664,0.0665,75550,1,75550,50.0,3777550.0,250829.32,True
8/22/10,2010-08-22 23:59:59,0.066,0.0664,75762,1,75762,50.0,3788150.0,250017.90000000002,True
8/23/10,2010-08-23 23:59:59,0.06491000000000001,0.066889999999999,75975,1,75975,50.0,3798800.0,246580.10800000004,True
8/24/10,2010-08-24 23:59:59,0.065,0.0665,76190,1,76190,50.0,3809550.0,247620.75,True
8/25/10,2010-08-25 23:59:59,0.0648,0.06644499999999999,76406,1,76406,50.0,3820350.0,247558.68,True
8/26/10,2010-08-26 23:59:59,0.064,0.0658,76616,1,76616,50.0,3830850.0,245174.4,True
8/27/10,2010-08-27 23:59:59,0.065,0.065,76787,1,76787,50.0,3839400.0,249561.0,True
8/28/10,2010-08-28 23:59:59,0.0646,0.065,76957,1,76957,50.0,3847900.0,248574.34000000003,True
8/29/10,2010-08-29 23:59:59,0.064,0.06470000000000001,77119,1,77119,50.0,3856000.0,246784.0,True
8/30/10,2010-08-30 23:59:59,0.06497,0.065,77268,1,77268,50.0,3863450.0,251008.3465,True
8/31/10,2010-08-31 23:59:59,0.06,0.06497,77452,1,77452,50.0,3872650.0,232359.0,True
9/1/10,2010-09-01 23:59:59,0.06230000000000001,0.06230000000000001,77609,1,77609,50.0,3880500.0,241755.15000000002,True
9/2/10,2010-09-02 23:59:59,0.0631,0.0631,77765,1,77765,50.0,3888300.0,245351.73,True
9/3/10,2010-09-03 23:59:59,0.06085000000000001,0.0631,77929,1,77929,50.0,3896500.0,237102.02500000002,True
9/4/10,2010-09-04 23:59:59,0.062380000000000005,0.062380000000000005,78110,1,78110,50.0,3905550.0,243628.20900000003,True
9/5/10,2010-09-05 23:59:59,0.0616,0.06343333333333301,78275,1,78275,50.0,3913800.0,241090.08000000002,True
9/6/10,2010-09-06 23:59:59,0.0616,0.0627,78433,1,78433,50.0,3921700.0,241576.72,True
9/7/10,2010-09-07 23:59:59,0.061505,0.062,78593,1,78593,50.0,3929700.0,241696.1985,True
9/8/10,2010-09-08 23:59:59,0.061494999999999994,0.061505,78758,1,78758,50.0,3937950.0,242164.23524999997,True
9/9/10,2010-09-09 23:59:59,0.061,0.062400000000000004,78893,1,78893,50.0,3944700.0,240626.69999999998,True
9/10/10,2010-09-10 23:59:59,0.0618,0.0618,79070,1,79070,50.0,3953550.0,244329.39,True
9/11/10,2010-09-11 23:59:59,0.06366000000000001,0.064366666666666,79230,1,79230,50.0,3961550.0,252192.27300000004,True
9/12/10,2010-09-12 23:59:59,0.061500000000000006,0.06366000000000001,79407,1,79407,50.0,3970400.0,244179.60000000003,True
9/13/10,2010-09-13 23:59:59,0.06217999999999901,0.064,79578,1,79578,50.0,3978950.0,247411.11099999605,True
9/14/10,2010-09-14 23:59:59,0.06199,0.17500000000000002,79781,1,79781,50.0,3989100.0,247284.309,True
9/15/10,2010-09-15 23:59:59,0.0604,0.0625,79950,1,79950,50.0,3997550.0,241452.02000000002,True
9/16/10,2010-09-16 23:59:59,0.0618,0.0618,80169,1,80169,50.0,4008500.0,247725.30000000002,True
9/17/10,2010-09-17 23:59:59,0.05938,0.0618,80377,1,80377,50.0,4018900.0,238642.282,True
9/18/10,2010-09-18 23:59:59,0.061,0.061,80614,1,80614,50.0,4030750.0,245875.75,True
9/19/10,2010-09-19 23:59:59,0.0627,0.0627,80823,1,80823,50.0,4041200.0,253383.24000000002,True
9/20/10,2010-09-20 23:59:59,0.0621,0.063349999999999,81026,1,81026,50.0,4051350.0,251588.83500000002,True
9/21/10,2010-09-21 23:59:59,0.06265000000000001,0.06330000000000001,81198,1,81198,50.0,4059950.0,254355.86750000005,True
9/22/10,2010-09-22 23:59:59,0.062037999999999996,0.06265000000000001,81372,1,81372,50.0,4068650.0,252410.90869999997,True
9/23/10,2010-09-23 23:59:59,0.062310000000000004,0.0629,81606,1,81606,50.0,4080350.0,254246.60850000003,True
9/24/10,2010-09-24 23:59:59,0.062200000000000005,0.062380000000000005,81834,1,81834,50.0,4091750.0,254506.85000000003,True
9/25/10,2010-09-25 23:59:59,0.062020000000000006,0.062360000000000006,82041,1,82041,50.0,4102100.0,254412.24200000003,True
9/26/10,2010-09-26 23:59:59,0.06219,0.06224777777777701,82246,1,82246,50.0,4112350.0,255747.0465,True
9/27/10,2010-09-27 23:59:59,0.062200000000000005,0.062279999999999,82475,1,82475,50.0,4123800.0,256500.36000000002,True
9/28/10,2010-09-28 23:59:59,0.061904999999999,0.062354999999999,82687,1,82687,50.0,4134400.0,255940.03199999587,True
9/29/10,2010-09-29 23:59:59,0.06183,0.062,82851,1,82851,50.0,4142600.0,256136.958,True
9/30/10,2010-09-30 23:59:59,0.061900000000000004,0.061900000000000004,82997,1,82997,50.0,4149900.0,256878.81000000003,True
10/1/10,2010-10-01 23:59:59,0.061970000000000004,0.062,83151,1,83151,50.0,4157600.0,257646.472,True
10/2/10,2010-10-02 23:59:59,0.0614,0.061970000000000004,83251,1,83251,50.0,4162600.0,255583.64,True
10/3/10,2010-10-03 23:59:59,0.061110000000000005,0.0614,83373,1,83373,50.0,4168700.0,254749.257,True
10/4/10,2010-10-04 23:59:59,0.061290000000000004,0.06191000000000001,83526,1,83526,50.0,4176350.0,255968.4915,True
10/5/10,2010-10-05 23:59:59,0.0614,0.062921666666666,83652,1,83652,50.0,4182650.0,256814.71000000002,True
10/6/10,2010-10-06 23:59:59,0.062976666666666,0.063490666666666,83823,1,83823,50.0,4191200.0,263947.8053333305,True
10/7/10,2010-10-07 23:59:59,0.067,0.067,83983,1,83983,50.0,4199200.0,281346.4,True
10/8/10,2010-10-08 23:59:59,0.084925,0.08799000000000001,84137,1,84137,50.0,4206900.0,357270.9825,True
10/9/10,2010-10-09 23:59:59,0.09380000000000001,0.11,84295,1,84295,50.0,4214800.0,395348.24000000005,True
10/10/10,2010-10-10 23:59:59,0.091,0.1301,84473,1,84473,50.0,4223700.0,384356.7,True
10/11/10,2010-10-11 23:59:59,0.095,0.1015,84632,1,84632,50.0,4231650.0,402006.75,True
10/12/10,2010-10-12 23:59:59,0.0949,0.09795000000000001,84787,1,84787,50.0,4239400.0,402319.06,True
10/13/10,2010-10-13 23:59:59,0.105,0.105,84963,1,84963,50.0,4248200.0,446061.0,True
10/14/10,2010-10-14 23:59:59,0.10200000000000001,0.105,85168,1,85168,50.0,4258450.0,434361.9,True
10/15/10,2010-10-15 23:59:59,0.105,0.11699999999999901,85345,1,85345,50.0,4267300.0,448066.5,True
10/16/10,2010-10-16 23:59:59,0.101,0.105,85603,1,85603,50.0,4280200.0,432300.2,True
10/17/10,2010-10-17 23:59:59,0.10200000000000001,0.10450000000000001,85873,1,85873,50.0,4293700.0,437957.4,True
10/18/10,2010-10-18 23:59:59,0.1024,0.10300000000000001,86122,1,86122,50.0,4306150.0,440949.76,True
10/19/10,2010-10-19 23:59:59,0.09715000000000001,0.1024,86378,1,86378,50.0,4318950.0,419585.99250000005,True
10/20/10,2010-10-20 23:59:59,0.099,0.10250000000000001,86642,1,86642,50.0,4332150.0,428882.85000000003,True
10/21/10,2010-10-21 23:59:59,0.107,0.107,86828,1,86828,50.0,4341450.0,464535.14999999997,True
10/22/10,2010-10-22 23:59:59,0.106,0.109,86982,1,86982,50.0,4349150.0,461009.89999999997,True
10/23/10,2010-10-23 23:59:59,0.10499499999999999,0.109,87157,1,87157,50.0,4357900.0,457557.7105,True
10/24/10,2010-10-24 23:59:59,0.11501000000000001,0.19,87362,1,87362,50.0,4368150.0,502380.93150000006,True
10/25/10,2010-10-25 23:59:59,0.132,0.186666666666666,87565,1,87565,50.0,4378300.0,577935.6,True
10/26/10,2010-10-26 23:59:59,0.151,0.179,87806,1,87806,50.0,4390350.0,662942.85,True
10/27/10,2010-10-27 23:59:59,0.1877,0.19,88019,1,88019,50.0,4401000.0,826067.7000000001,True
10/28/10,2010-10-28 23:59:59,0.1731,0.19001,88238,1,88238,50.0,4411950.0,763708.545,True
10/29/10,2010-10-29 23:59:59,0.19,0.19,88461,1,88461,50.0,4423100.0,840389.0,True
10/30/10,2010-10-30 23:59:59,0.19890000000000002,0.19890000000000002,88713,1,88713,50.0,4435700.0,882260.7300000001,True
10/31/10,2010-10-31 23:59:59,0.1925,0.19890000000000002,88892,1,88892,50.0,4444650.0,855595.125,True
11/1/10,2010-11-01 23:59:59,0.1955,0.1955,89069,1,89069,50.0,4453500.0,870659.25,True
11/2/10,2010-11-02 23:59:59,0.1938,0.1955,89245,1,89245,50.0,4462300.0,864793.74,True
11/3/10,2010-11-03 23:59:59,0.19310000000000002,0.2369,89435,1,89435,50.0,4471800.0,863504.5800000001,True
11/4/10,2010-11-04 23:59:59,0.23,0.23601000000000003,89636,1,89636,50.0,4481850.0,1030825.5,True
11/5/10,2010-11-05 23:59:59,0.262,0.2639,89855,1,89855,50.0,4492800.0,1177113.6,True
11/6/10,2010-11-06 23:59:59,0.401666666666666,0.49,90073,1,90073,50.0,4503700.0,1808986.1666666637,True
11/7/10,2010-11-07 23:59:59,0.34,0.4399,90314,1,90314,50.0,4515750.0,1535355.0,True
11/8/10,2010-11-08 23:59:59,0.243,0.36810000000000004,90589,1,90589,50.0,4529500.0,1100668.5,True
11/9/10,2010-11-09 23:59:59,0.21,0.322999999999999,90806,1,90806,50.0,4540350.0,953473.5,True
11/10/10,2010-11-10 23:59:59,0.23620000000000002,0.23620000000000002,91009,1,91009,50.0,4550500.0,1074828.1,True
11/11/10,2010-11-11 23:59:59,0.22310000000000002,0.24,91228,1,91228,50.0,4561450.0,1017659.4950000001,True
11/12/10,2010-11-12 23:59:59,0.2682,0.28300000000000003,91397,1,91397,50.0,4569900.0,1225647.18,True
11/13/10,2010-11-13 23:59:59,0.276,0.299936666666666,91620,1,91620,50.0,4581050.0,1264369.8,True
11/14/10,2010-11-14 23:59:59,0.27904,0.299,91876,1,91876,50.0,4593850.0,1281867.904,True
11/15/10,2010-11-15 23:59:59,0.2682,0.2828,92076,1,92076,50.0,4603850.0,1234752.57,True
11/16/10,2010-11-16 23:59:59,0.225,0.275,92273,1,92273,50.0,4613700.0,1038082.5,True
11/17/10,2010-11-17 23:59:59,0.247366666666666,0.28800000000000003,92520,1,92520,50.0,4626050.0,1144330.5683333303,True
11/18/10,2010-11-18 23:59:59,0.26780000000000004,0.281,92777,1,92777,50.0,4638900.0,1242297.4200000002,True
11/19/10,2010-11-19 23:59:59,0.2752,0.28,92927,1,92927,50.0,4646400.0,1278689.28,True
11/20/10,2010-11-20 23:59:59,0.283955,0.29,93043,1,93043,50.0,4652200.0,1321015.4510000001,True
11/21/10,2010-11-21 23:59:59,0.27675,0.283955,93183,1,93183,50.0,4659200.0,1289433.6,True
11/22/10,2010-11-22 23:59:59,0.2843,0.2843,93346,1,93346,50.0,4667350.0,1326927.605,True
11/23/10,2010-11-23 23:59:59,0.28295000000000003,0.28449,93486,1,93486,50.0,4674350.0,1322607.3325000003,True
11/24/10,2010-11-24 23:59:59,0.28299,0.28299,93663,1,93663,50.0,4683200.0,1325298.7680000002,True
11/25/10,2010-11-25 23:59:59,0.28,0.28299,93844,1,93844,50.0,4692250.0,1313830.0000000002,True
11/26/10,2010-11-26 23:59:59,0.2844,0.2864,94038,1,94038,50.0,4701950.0,1337234.5799999998,True
11/27/10,2010-11-27 23:59:59,0.28300000000000003,0.2844,94218,1,94218,50.0,4710950.0,1333198.85,True
11/28/10,2010-11-28 23:59:59,0.271081967213114,0.28461000000000003,94390,1,94390,50.0,4719550.0,1279384.8983606522,True
11/29/10,2010-11-29 23:59:59,0.22990000000000002,0.279,94599,1,94599,50.0,4730000.0,1087427.0,True
11/30/10,2010-11-30 23:59:59,0.2082,0.22990000000000002,94800,1,94800,50.0,4740050.0,986878.41,True
12/1/10,2010-12-01 23:59:59,0.2275,0.22790000000000002,94989,1,94989,50.0,4749500.0,1080511.25,True
12/2/10,2010-12-02 23:59:59,0.255,0.255,95177,1,95177,50.0,4758900.0,1213519.5,True
12/3/10,2010-12-03 23:59:59,0.25105,0.25520000000000004,95366,1,95366,50.0,4768350.0,1197094.2675,True
12/4/10,2010-12-04 23:59:59,0.20600000000000002,0.25880749999999997,95595,1,95595,50.0,4779800.0,984638.8,True
12/5/10,2010-12-05 23:59:59,0.195,0.234,95834,1,95834,50.0,4791750.0,934391.25,True
12/6/10,2010-12-06 23:59:59,0.20400000000000001,0.225,96075,1,96075,50.0,4803800.0,979975.2000000001,True
12/7/10,2010-12-07 23:59:59,0.24,0.245,96314,1,96314,50.0,4815750.0,1155780.0,True
12/8/10,2010-12-08 23:59:59,0.2388,0.24,96552,1,96552,50.0,4827650.0,1152842.82,True
12/9/10,2010-12-09 23:59:59,0.192105,0.2388,96775,1,96775,50.0,4838800.0,929557.674,True
12/10/10,2010-12-10 23:59:59,0.20385,0.20385,96922,1,96922,50.0,4846150.0,987887.6775,True
12/11/10,2010-12-11 23:59:59,0.228,0.228,97097,1,97097,50.0,4854900.0,1106917.2,True
12/12/10,2010-12-12 23:59:59,0.22,0.228,97268,1,97268,50.0,4863450.0,1069959.0,True
12/13/10,2010-12-13 23:59:59,0.22990000000000002,0.22990000000000002,97409,1,97409,50.0,4870500.0,1119727.9500000002,True
12/14/10,2010-12-14 23:59:59,0.24669000000000002,0.24669000000000002,97581,1,97581,50.0,4879100.0,1203625.179,True
12/15/10,2010-12-15 23:59:59,0.24,0.24669000000000002,97776,1,97776,50.0,4888850.0,1173324.0,True
12/16/10,2010-12-16 23:59:59,0.24996000000000002,0.255,97949,1,97949,50.0,4897500.0,1224179.1,True
12/17/10,2010-12-17 23:59:59,0.24,0.24996000000000002,98115,1,98115,50.0,4905800.0,1177392.0,True
12/18/10,2010-12-18 23:59:59,0.241,0.24881000000000003,98276,1,98276,50.0,4913850.0,1184237.8499999999,True
12/19/10,2010-12-19 23:59:59,0.2401,0.2499,98460,1,98460,50.0,4923050.0,1182024.305,True
12/20/10,2010-12-20 23:59:59,0.267,0.27111,98619,1,98619,50.0,4931000.0,1316577.0,True
12/21/10,2010-12-21 23:59:59,0.24,0.267,98815,1,98815,50.0,4940800.0,1185792.0,True
12/22/10,2010-12-22 23:59:59,0.25,0.25,98972,1,98972,50.0,4948650.0,1237162.5,True
12/23/10,2010-12-23 23:59:59,0.25,0.25,99117,1,99117,50.0,4955900.0,1238975.0,True
12/24/10,2010-12-24 23:59:59,0.248,0.25,99265,1,99265,50.0,4963300.0,1230898.4,True
12/25/10,2010-12-25 23:59:59,0.2499,0.25,99433,1,99433,50.0,4971700.0,1242427.83,True
12/26/10,2010-12-26 23:59:59,0.265,0.265,99578,1,99578,50.0,4978950.0,1319421.75,True
12/27/10,2010-12-27 23:59:59,0.265,0.27,99744,1,99744,50.0,4987250.0,1321621.25,True
12/28/10,2010-12-28 23:59:59,0.281,0.281,99913,1,99913,50.0,4995700.0,1403791.7000000002,True
12/29/10,2010-12-29 23:59:59,0.2998,0.301,100078,1,100078,50.0,5003950.0,1500184.21,True
12/30/10,2010-12-30 23:59:59,0.30000000000000004,0.30000000000000004,100247,1,100247,50.0,5012400.0,1503720.0000000002,True
12/31/10,2010-12-31 23:59:59,0.30000000000000004,0.30000000000000004,100409,1,100409,50.0,5020500.0,1506150.0000000002,True
1/1/11,2011-01-01 23:59:59,0.30000000000000004,0.30000000000000004,100590,1,100590,50.0,5029550.0,1508865.0000000002,True
1/2/11,2011-01-02 23:59:59,0.29997,0.30000000000000004,100765,1,100765,50.0,5038300.0,1511338.851,True
1/3/11,2011-01-03 23:59:59,0.295,0.29997,100921,1,100921,50.0,5046100.0,1488599.5,True
1/4/11,2011-01-04 23:59:59,0.29895000000000005,0.29895000000000005,101062,1,101062,50.0,5053150.0,1510639.1925000004,True
1/5/11,2011-01-05 23:59:59,0.29892,0.299,101216,1,101216,50.0,5060850.0,1512789.2820000001,True
1/6/11,2011-01-06 23:59:59,0.298,0.299,101357,1,101357,50.0,5067900.0,1510234.2,True
1/7/11,2011-01-07 23:59:59,0.32,0.321,101521,1,101521,50.0,5076100.0,1624352.0,True
1/8/11,2011-01-08 23:59:59,0.3229,0.3229,101691,1,101691,50.0,5084600.0,1641817.34,True
1/9/11,2011-01-09 23:59:59,0.322999999999999,0.322999999999999,101854,1,101854,50.0,5092750.0,1644958.2499999949,True
1/10/11,2011-01-10 23:59:59,0.32659000000000005,0.329,102016,1,102016,50.0,5100850.0,1665886.6015000003,True
1/11/11,2011-01-11 23:59:59,0.32659000000000005,0.32659000000000005,102187,1,102187,50.0,5109400.0,1668678.9460000002,True
1/12/11,2011-01-12 23:59:59,0.31880000000000003,0.3557,102355,1,102355,50.0,5117800.0,1631554.6400000001,True
1/13/11,2011-01-13 23:59:59,0.3176,0.405,102543,1,102543,50.0,5127200.0,1628398.72,True
1/14/11,2011-01-14 23:59:59,0.4,0.40058000000000005,102724,1,102724,50.0,5136250.0,2054500.0,True
1/15/11,2011-01-15 23:59:59,0.386,0.4,102881,1,102881,50.0,5144100.0,1985622.6,True
1/16/11,2011-01-16 23:59:59,0.38679,0.4,103055,1,103055,50.0,5152800.0,1993051.512,True
1/17/11,2011-01-17 23:59:59,0.34950000000000003,0.38679,103236,1,103236,50.0,5161850.0,1804066.5750000002,True
1/18/11,2011-01-18 23:59:59,0.31299000000000005,0.34950000000000003,103377,1,103377,50.0,5168900.0,1617814.0110000002,True
1/19/11,2011-01-19 23:59:59,0.31299000000000005,0.31299000000000005,103546,1,103546,50.0,5177350.0,1620458.7765000002,True
1/20/11,2011-01-20 23:59:59,0.39,0.39,103731,1,103731,50.0,5186600.0,2022774.0,True
1/21/11,2011-01-21 23:59:59,0.419905,0.4299,103907,1,103907,50.0,5195400.0,2181574.437,True
1/22/11,2011-01-22 23:59:59,0.44399000000000005,0.444,104071,1,104071,50.0,5203600.0,2310346.364,True
1/23/11,2011-01-23 23:59:59,0.4262,0.44430000000000003,104241,1,104241,50.0,5212100.0,2221397.02,True
1/24/11,2011-01-24 23:59:59,0.4199,0.4319,104429,1,104429,50.0,5221500.0,2192507.85,True
1/25/11,2011-01-25 23:59:59,0.41000000000000003,0.425,104585,1,104585,50.0,5229300.0,2144013.0,True
1/26/11,2011-01-26 23:59:59,0.41367000000000004,0.42,104765,1,104765,50.0,5238300.0,2166927.561,True
1/27/11,2011-01-27 23:59:59,0.4212,0.445,104925,1,104925,50.0,5246300.0,2209741.56,True
1/28/11,2011-01-28 23:59:59,0.446,0.446,105083,1,105083,50.0,5254200.0,2343373.2,True
1/29/11,2011-01-29 23:59:59,0.439,0.446,105244,1,105244,50.0,5262250.0,2310127.75,True
1/30/11,2011-01-30 23:59:59,0.47981,0.48,105400,1,105400,50.0,5270050.0,2528622.6905,True
1/31/11,2011-01-31 23:59:59,0.5501,0.8166666666666661,105570,1,105570,50.0,5278550.0,2903730.355,True
2/1/11,2011-02-01 23:59:59,0.7077300000000001,0.8442000000000001,105734,1,105734,50.0,5286750.0,3741591.5775000006,True
2/2/11,2011-02-02 23:59:59,0.73816,0.7600100000000001,105892,1,105892,50.0,5294650.0,3908298.844,True
2/3/11,2011-02-03 23:59:59,0.6963900000000001,0.746,106052,1,106052,50.0,5302650.0,3692712.4335000003,True
2/4/11,2011-02-04 23:59:59,0.810999999999999,0.8501000000000001,106246,1,106246,50.0,5312350.0,4308315.849999995,True
2/5/11,2011-02-05 23:59:59,0.9073500000000001,0.9167000000000001,106425,1,106425,50.0,5321300.0,4828281.555000001,True
2/6/11,2011-02-06 23:59:59,0.8968,0.92,106602,1,106602,50.0,5330150.0,4780078.5200000005,True
2/7/11,2011-02-07 23:59:59,0.89,0.9,106805,1,106805,50.0,5340300.0,4752867.0,True
2/8/11,2011-02-08 23:59:59,0.918,0.918,106973,1,106973,50.0,5348700.0,4910106.600000001,True
2/9/11,2011-02-09 23:59:59,1.08,1.09,107165,1,107165,50.0,5358300.0,5786964.0,True
2/10/11,2011-02-10 23:59:59,0.9751549999999991,1.1,107351,1,107351,50.0,5367600.0,5234241.977999995,True
2/11/11,2011-02-11 23:59:59,1.070004999999999,1.0899,107537,1,107537,50.0,5376900.0,5753309.884499994,True
2/12/11,2011-02-12 23:59:59,1.0799,1.08,107733,1,107733,50.0,5386700.0,5817097.33,True
2/13/11,2011-02-13 23:59:59,1.04,1.08,107931,1,107931,50.0,5396600.0,5612464.0,True
2/14/11,2011-02-14 23:59:59,1.075336666666666,1.08,108127,1,108127,50.0,5406400.0,5813700.154666663,True
2/15/11,2011-02-15 23:59:59,1.05,1.08,108352,1,108352,50.0,5417650.0,5688532.5,True
2/16/11,2011-02-16 23:59:59,1.028624,1.05019,108584,1,108584,50.0,5429250.0,5584656.852,True
2/17/11,2011-02-17 23:59:59,1.04,1.05019,108815,1,108815,50.0,5440800.0,5658432.0,True
2/18/11,2011-02-18 23:59:59,0.899,1.04019,109027,1,109027,50.0,5451400.0,4900808.600000001,True
2/19/11,2011-02-19 23:59:59,0.94898,0.98,109188,1,109188,50.0,5459450.0,5180908.8610000005,True
2/20/11,2011-02-20 23:59:59,0.85,0.94898,109386,1,109386,50.0,5469350.0,4648947.5,True
2/21/11,2011-02-21 23:59:59,0.8345,0.8796,109580,1,109580,50.0,5479050.0,4572267.225000001,True
2/22/11,2011-02-22 23:59:59,0.8702300000000001,0.93,109791,1,109791,50.0,5489600.0,4777214.608,True
2/23/11,2011-02-23 23:59:59,0.9,0.9391200000000001,110034,1,110034,50.0,5501750.0,4951575.0,True
2/24/11,2011-02-24 23:59:59,0.9937149999999999,1.0,110241,1,110241,50.0,5512100.0,5477456.4514999995,True
2/25/11,2011-02-25 23:59:59,0.9111,0.9997900000000001,110466,1,110466,50.0,5523350.0,5032324.1850000005,True
2/26/11,2011-02-26 23:59:59,0.9580000000000001,0.97,110742,1,110742,50.0,5537150.0,5304589.7,True
2/27/11,2011-02-27 23:59:59,0.890089999999999,0.9580000000000001,110986,1,110986,50.0,5549350.0,4939420.941499995,True
2/28/11,2011-02-28 23:59:59,0.8601000000000001,0.92,111136,1,111136,50.0,5556850.0,4779446.6850000005,True
3/1/11,2011-03-01 23:59:59,0.9202100000000001,0.9696,111266,1,111266,50.0,5563350.0,5119450.3035,True
3/2/11,2011-03-02 23:59:59,0.9399000000000001,0.9400000000000001,111434,1,111434,50.0,5571750.0,5236887.825,True
3/3/11,2011-03-03 23:59:59,0.9390900000000001,0.9399000000000001,111620,1,111620,50.0,5581050.0,5241108.244500001,True
3/4/11,2011-03-04 23:59:59,0.9012,0.9390900000000001,111841,1,111841,50.0,5592100.0,5039600.52,True
3/5/11,2011-03-05 23:59:59,0.9103,0.9189,112118,1,112118,50.0,5605950.0,5103096.285,True
3/6/11,2011-03-06 23:59:59,0.886629999999999,0.9103,112392,1,112392,50.0,5619650.0,4982550.279499995,True
3/7/11,2011-03-07 23:59:59,0.88502,0.9083366666666661,112603,1,112603,50.0,5630200.0,4982839.604,True
3/8/11,2011-03-08 23:59:59,0.8513200000000001,0.88502,112790,1,112790,50.0,5639550.0,4801061.706,True
3/9/11,2011-03-09 23:59:59,0.8644900000000001,0.87,112950,1,112950,50.0,5647550.0,4882250.499500001,True
3/10/11,2011-03-10 23:59:59,0.9329000000000001,0.9329000000000001,113060,1,113060,50.0,5653050.0,5273730.345000001,True
3/11/11,2011-03-11 23:59:59,0.88,0.9329000000000001,113190,1,113190,50.0,5659550.0,4980404.0,True
3/12/11,2011-03-12 23:59:59,0.918,0.9197000000000001,113330,1,113330,50.0,5666550.0,5201892.9,True
3/13/11,2011-03-13 23:59:59,0.8924900000000001,0.918,113447,1,113447,50.0,5672400.0,5062560.276000001,True
3/14/11,2011-03-14 23:59:59,0.8949,0.9,113559,1,113559,50.0,5678000.0,5081242.2,True
3/15/11,2011-03-15 23:59:59,0.8711200000000001,0.8949,113671,1,113671,50.0,5683600.0,4951097.632,True
3/16/11,2011-03-16 23:59:59,0.8361000000000001,0.88,113807,1,113807,50.0,5690400.0,4757743.44,True
3/17/11,2011-03-17 23:59:59,0.82542,0.88,113948,1,113948,50.0,5697450.0,4702789.1790000005,True
3/18/11,2011-03-18 23:59:59,0.8164800000000001,0.85062,114068,1,114068,50.0,5703450.0,4656752.856000001,True
3/19/11,2011-03-19 23:59:59,0.765,0.8164800000000001,114183,1,114183,50.0,5709200.0,4367538.0,True
3/20/11,2011-03-20 23:59:59,0.7410800000000001,0.79,114320,1,114320,50.0,5716050.0,4236050.334000001,True
3/21/11,2011-03-21 23:59:59,0.75897,0.772405,114468,1,114468,50.0,5723450.0,4343926.8465,True
3/22/11,2011-03-22 23:59:59,0.8090100000000001,0.81,114587,1,114587,50.0,5729400.0,4635141.894,True
3/23/11,2011-03-23 23:59:59,0.8497100000000001,0.8498500000000001,114744,1,114744,50.0,5737250.0,4874998.697500001,True
3/24/11,2011-03-24 23:59:59,0.8668799999999991,0.8989266666666661,114896,1,114896,50.0,5744850.0,4980095.567999994,True
3/25/11,2011-03-25 23:59:59,0.8837700000000001,0.8899900000000001,115069,1,115069,50.0,5753500.0,5084770.695,True
3/26/11,2011-03-26 23:59:59,0.8552000000000001,0.9024500000000001,115207,1,115207,50.0,5760400.0,4926294.08,True
3/27/11,2011-03-27 23:59:59,0.827539999999999,0.87211,115350,1,115350,50.0,5767550.0,4772878.326999995,True
3/28/11,2011-03-28 23:59:59,0.79898,0.8430000000000001,115518,1,115518,50.0,5775950.0,4614868.531,True
3/29/11,2011-03-29 23:59:59,0.7925000000000001,0.79966,115681,1,115681,50.0,5784100.0,4583899.250000001,True
3/30/11,2011-03-30 23:59:59,0.7897000000000001,0.795,115837,1,115837,50.0,5791900.0,4573863.430000001,True
3/31/11,2011-03-31 23:59:59,0.78461,0.80098,116038,1,116038,50.0,5801950.0,4552267.9895,True
4/1/11,2011-04-01 23:59:59,0.7741100000000001,0.7969700000000001,116214,1,116214,50.0,5810750.0,4498159.6825,True
4/2/11,2011-04-02 23:59:59,0.7819900000000001,0.797999999999999,116394,1,116394,50.0,5819750.0,4550986.3025,True
4/3/11,2011-04-03 23:59:59,0.779,0.7921,116569,1,116569,50.0,5828500.0,4540401.5,True
4/4/11,2011-04-04 23:59:59,0.6900000000000001,0.78495,116747,1,116747,50.0,5837400.0,4027806.0000000005,True
4/5/11,2011-04-05 23:59:59,0.71,0.7478,116941,1,116941,50.0,5847100.0,4151441.0,True
4/6/11,2011-04-06 23:59:59,0.74,0.75,117090,1,117090,50.0,5854550.0,4332367.0,True
4/7/11,2011-04-07 23:59:59,0.7538,0.784905,117236,1,117236,50.0,5861850.0,4418662.53,True
4/8/11,2011-04-08 23:59:59,0.749989999999999,0.799,117402,1,117402,50.0,5870150.0,4402553.798499994,True
4/9/11,2011-04-09 23:59:59,0.7465839999999999,0.7676000000000001,117558,1,117558,50.0,5877950.0,4388383.4228,True
4/10/11,2011-04-10 23:59:59,0.7373200000000001,0.7589,117731,1,117731,50.0,5886600.0,4340307.9120000005,True
4/11/11,2011-04-11 23:59:59,0.7787000000000001,0.798489999999999,117894,1,117894,50.0,5894750.0,4590241.825,True
4/12/11,2011-04-12 23:59:59,0.86,0.899,118057,1,118057,50.0,5902900.0,5076494.0,True
4/13/11,2011-04-13 23:59:59,0.9307500000000001,1.0,118251,1,118251,50.0,5912600.0,5503152.45,True
4/14/11,2011-04-14 23:59:59,0.9999,1.0,118411,1,118411,50.0,5920600.0,5920007.94,True
4/15/11,2011-04-15 23:59:59,0.9788985714285711,1.08999,118547,1,118547,50.0,5927400.0,5802323.392285712,True
4/16/11,2011-04-16 23:59:59,1.048,1.095,118720,1,118720,50.0,5936050.0,6220980.4,True
4/17/11,2011-04-17 23:59:59,1.14438,1.13057,118900,1,118900,50.0,5945050.0,6803396.319,True
4/18/11,2011-04-18 23:59:59,1.1618,1.1997,119048,1,119048,50.0,5952450.0,6915556.409999999,True
4/19/11,2011-04-19 23:59:59,1.181,1.1979,119202,1,119202,50.0,5960150.0,7038937.15,True
4/20/11,2011-04-20 23:59:59,1.1421000000000001,1.1974,119346,1,119346,50.0,5967350.0,6815310.4350000005,True
4/21/11,2011-04-21 23:59:59,1.202,1.21,119493,1,119493,50.0,5974700.0,7181589.399999999,True
4/22/11,2011-04-22 23:59:59,1.4046,1.41,119669,1,119669,50.0,5983500.0,8404424.1,True
4/23/11,2011-04-23 23:59:59,1.7799966666666671,1.95,119841,1,119841,50.0,5992100.0,10665918.026333336,True
4/24/11,2011-04-24 23:59:59,1.6311,1.87395,120003,1,120003,50.0,6000200.0,9786926.22,True
4/25/11,2011-04-25 23:59:59,1.571015,1.685421999999999,120195,1,120195,50.0,6009800.0,9441485.947,True
4/26/11,2011-04-26 23:59:59,1.7826,1.7949,120390,1,120390,50.0,6019550.0,10730449.83,True
4/27/11,2011-04-27 23:59:59,1.9000000000000001,1.949884999999999,120573,1,120573,50.0,6028700.0,11454530.0,True
4/28/11,2011-04-28 23:59:59,2.218396,2.59143,120737,1,120737,50.0,6036900.0,13392234.812399998,True
4/29/11,2011-04-29 23:59:59,2.8845,2.9125,120937,1,120937,50.0,6046900.0,17442283.05,True
4/30/11,2011-04-30 23:59:59,3.5,4.005604,121126,1,121126,50.0,6056350.0,21197225.0,True
5/1/11,2011-05-01 23:59:59,3.0988,3.7999,121305,1,121305,50.0,6065300.0,18795151.64,True
5/2/11,2011-05-02 23:59:59,3.2,3.494905,121502,1,121502,50.0,6075150.0,19440480.0,True
5/3/11,2011-05-03 23:59:59,3.535,3.45825,121698,1,121698,50.0,6084950.0,21510298.25,True
5/4/11,2011-05-04 23:59:59,3.404493333333333,3.535,121895,1,121895,50.0,6094800.0,20749705.968,True
5/5/11,2011-05-05 23:59:59,3.335,3.4498,122114,1,122114,50.0,6105750.0,20362676.25,True
5/6/11,2011-05-06 23:59:59,3.452,3.596644444444444,122332,1,122332,50.0,6116650.0,21114675.8,True
5/7/11,2011-05-07 23:59:59,3.64012,3.7,122546,1,122546,50.0,6127350.0,22304289.282,True
5/8/11,2011-05-08 23:59:59,3.867073333333333,3.9,122765,1,122765,50.0,6138300.0,23737256.242,True
5/9/11,2011-05-09 23:59:59,3.82995,3.8999,123004,1,123004,50.0,6150250.0,23555149.9875,True
5/10/11,2011-05-10 23:59:59,5.687,5.948076666666667,123187,1,123187,50.0,6159400.0,35028507.800000004,True
5/11/11,2011-05-11 23:59:59,5.4898,5.89991,123378,1,123378,50.0,6168950.0,33866301.71,True
5/12/11,2011-05-12 23:59:59,6.3201,6.458628636363636,123547,1,123547,50.0,6177400.0,39041785.74,True
5/13/11,2011-05-13 23:59:59,8.1201,8.413960000000001,123754,1,123754,50.0,6187750.0,50245148.775000006,True
5/14/11,2011-05-14 23:59:59,6.95,8.849523333333334,123996,1,123996,50.0,6199850.0,43088957.5,True
5/15/11,2011-05-15 23:59:59,6.9,7.565719,124216,1,124216,50.0,6210850.0,42854865.0,True
5/16/11,2011-05-16 23:59:59,8.044694999999999,8.426316666666667,124463,1,124463,50.0,6223200.0,50063745.923999995,True
5/17/11,2011-05-17 23:59:59,7.233933333333334,8.270231428571426,124720,1,124720,50.0,6236050.0,45111169.96333334,True
5/18/11,2011-05-18 23:59:59,6.7002,7.4473825,125008,1,125008,50.0,6250450.0,41879265.089999996,True
5/19/11,2011-05-19 23:59:59,6.969768181818181,7.3,125179,1,125179,50.0,6259000.0,43623779.05,True
5/20/11,2011-05-20 23:59:59,5.5903616666666665,7.074682941176469,125399,1,125399,50.0,6270000.0,35051567.65,True
5/21/11,2011-05-21 23:59:59,6.17,6.431588888888888,125619,1,125619,50.0,6281000.0,38753770.0,True
5/22/11,2011-05-22 23:59:59,6.69,6.7401,125870,1,125870,50.0,6293550.0,42103849.5,True
5/23/11,2011-05-23 23:59:59,7.100128333333331,7.390017142857142,126157,1,126157,50.0,6307900.0,44786899.51383332,True
5/24/11,2011-05-24 23:59:59,7.411506923076924,7.4866344444444435,126456,1,126456,50.0,6322850.0,46861846.54857693,True
5/25/11,2011-05-25 23:59:59,8.405085714285713,8.703583571428577,126763,1,126763,50.0,6338200.0,53273114.274285704,True
5/26/11,2011-05-26 23:59:59,8.7002725,8.866682222222222,127059,1,127059,50.0,6353000.0,55272831.1925,True
5/27/11,2011-05-27 23:59:59,8.5168,8.805601999999997,127226,1,127226,50.0,6361350.0,54178345.68,True
5/28/11,2011-05-28 23:59:59,8.351486249999999,8.69899,127381,1,127381,50.0,6369100.0,53191451.07487499,True
5/29/11,2011-05-29 23:59:59,8.418833333333334,8.489922857142858,127561,1,127561,50.0,6378100.0,53696160.88333333,True
5/30/11,2011-05-30 23:59:59,8.8,8.974317777777777,127715,1,127715,50.0,6385800.0,56195040.00000001,True
5/31/11,2011-05-31 23:59:59,8.722403333333334,9.451111111111112,127865,1,127865,50.0,6393300.0,55764941.231000006,True
6/1/11,2011-06-01 23:59:59,9.639830000000002,9.686029166666668,128053,1,128053,50.0,6402700.0,61720939.54100001,True
6/2/11,2011-06-02 23:59:59,10.744044444444445,10.783233333333332,128243,1,128243,50.0,6412200.0,68892961.78666666,True
6/3/11,2011-06-03 23:59:59,14.3112,14.421999999999995,128445,1,128445,50.0,6422300.0,91910819.75999999,True
6/4/11,2011-06-04 23:59:59,18.93489545454545,18.64759333333334,128669,1,128669,50.0,6433500.0,121817649.90681817,True
6/5/11,2011-06-05 23:59:59,16.68763636363636,18.93489545454545,128877,1,128877,50.0,6443900.0,107533459.96363635,True
6/6/11,2011-06-06 23:59:59,18.285,19.229666666666667,129110,1,129110,50.0,6455550.0,118039731.75,True
6/7/11,2011-06-07 23:59:59,23.49990909090909,23.98695263157895,129280,1,129280,50.0,6464050.0,151904587.3590909,True
6/8/11,2011-06-08 23:59:59,30.45661470588236,31.88444444444444,129465,1,129465,50.0,6473300.0,197154803.97558826,True
6/9/11,2011-06-09 23:59:59,28.683940000000003,31.49985500000001,129687,1,129687,50.0,6484400.0,185998140.536,True
6/10/11,2011-06-10 23:59:59,23.917425,29.34941,129910,1,129910,50.0,6495550.0,155356829.95875,True
6/11/11,2011-06-11 23:59:59,14.860921739130434,23.97416666666667,130162,1,130162,50.0,6508150.0,96717107.81652173,True
6/12/11,2011-06-12 23:59:59,18.352457142857148,23.80877428571429,130395,1,130395,50.0,6519800.0,119654350.08000003,True
6/13/11,2011-06-13 23:59:59,19.85402222222222,24.21390869565216,130622,1,130622,50.0,6531150.0,129669597.23666665,True
6/14/11,2011-06-14 23:59:59,19.43761250000001,20.385675862068968,130869,1,130869,50.0,6543500.0,127190017.39375007,True
6/15/11,2011-06-15 23:59:59,19.38966363636364,19.940158823529405,131148,1,131148,50.0,6557450.0,127146749.81227274,True
6/16/11,2011-06-16 23:59:59,16.854314634146345,19.84390909090909,131328,1,131328,50.0,6566450.0,110673014.32939027,True
6/17/11,2011-06-17 23:59:59,16.086016666666662,17.76104444444444,131514,1,131514,50.0,6575750.0,105777624.0958333,True
6/18/11,2011-06-18 23:59:59,16.903000000000002,16.8971375,131711,1,131711,50.0,6585600.0,111316396.80000001,True
6/19/11,2011-06-19 23:59:59,17.426032582027847,18.484259574468087,131934,1,131934,50.0,6596750.0,114955180.4354922,True
6/20/11,2011-06-20 23:59:59,17.56856506204949,17.60023455086677,132168,1,132168,50.0,6608450.0,116100983.78430095,True
6/21/11,2011-06-21 23:59:59,17.825395275127512,18.18623811659334,132421,1,132421,50.0,6621100.0,118023724.65614676,True
6/22/11,2011-06-22 23:59:59,17.89001100122738,17.915129692931533,132681,1,132681,50.0,6634100.0,118684121.98324256,True
6/23/11,2011-06-23 23:59:59,18.184895131441348,18.5048821061371,132921,1,132921,50.0,6646100.0,120858631.53307234,True
6/24/11,2011-06-24 23:59:59,18.580668891478226,18.6314477446375,133137,1,133137,50.0,6656900.0,123689654.7436814,True
6/25/11,2011-06-25 23:59:59,17.90337627705266,18.6286393757385,133280,1,133280,50.0,6664050.0,119308994.6790928,True
6/26/11,2011-06-26 23:59:59,16.406004,18.184227332122127,133429,1,133429,50.0,6671500.0,109452655.68599999,True
6/27/11,2011-06-27 23:59:59,16.73353625,17.793436470588233,133598,1,133598,50.0,6679950.0,111779185.4731875,True
6/28/11,2011-06-28 23:59:59,16.908387500000003,17.175,133758,1,133758,50.0,6687950.0,113082450.18062502,True
6/29/11,2011-06-29 23:59:59,16.846,17.047261538461534,133930,1,133930,50.0,6696550.0,112810081.3,True
6/30/11,2011-06-30 23:59:59,16.058145624999998,16.992343750000003,134121,1,134121,50.0,6706100.0,107687530.37581249,True
7/1/11,2011-07-01 23:59:59,15.454980000000004,16.700256399999994,134294,1,134294,50.0,6714750.0,103776326.95500003,True
7/2/11,2011-07-02 23:59:59,15.3134,15.787220000000001,134463,1,134463,50.0,6723200.0,102955050.88,True
7/3/11,2011-07-03 23:59:59,15.4557,15.648951666666667,134628,1,134628,50.0,6731450.0,104039271.765,True
7/4/11,2011-07-04 23:59:59,13.861750000000002,15.487106666666667,134798,1,134798,50.0,6739950.0,93427501.91250002,True
7/5/11,2011-07-05 23:59:59,12.689218333333335,14.204615833333335,134937,1,134937,50.0,6746900.0,85612887.17316668,True
7/6/11,2011-07-06 23:59:59,14.820032857142856,16.378641428571427,135094,1,135094,50.0,6754750.0,100105616.94178571,True
7/7/11,2011-07-07 23:59:59,14.793648999999998,15.623833090909086,135225,1,135225,50.0,6761300.0,100024298.98369999,True
7/8/11,2011-07-08 23:59:59,14.30362625,15.095248000000002,135390,1,135390,50.0,6769550.0,96829113.08068751,True
7/9/11,2011-07-09 23:59:59,14.383250000000002,14.587943333333332,135539,1,135539,50.0,6777000.0,97475285.25000001,True
7/10/11,2011-07-10 23:59:59,14.880453125,15.648228260869562,135676,1,135676,50.0,6783850.0,100946761.93203126,True
7/11/11,2011-07-11 23:59:59,14.208926000000002,15.1078347368421,135833,1,135833,50.0,6791700.0,96502762.7142,True
7/12/11,2011-07-12 23:59:59,14.055122500000001,14.608791250000005,135974,1,135974,50.0,6798750.0,95557264.09687501,True
7/13/11,2011-07-13 23:59:59,13.970210000000002,14.122569444444446,136165,1,136165,50.0,6808300.0,95113380.74300002,True
7/14/11,2011-07-14 23:59:59,14.020400000000002,14.033323333333335,136309,1,136309,50.0,6815500.0,95556036.20000002,True
7/15/11,2011-07-15 23:59:59,13.787692499999999,14.087585,136471,1,136471,50.0,6823600.0,94081698.54299998,True
7/16/11,2011-07-16 23:59:59,13.719327222222226,13.7999,136628,1,136628,50.0,6831450.0,93722897.95225003,True
7/17/11,2011-07-17 23:59:59,13.13850875,13.731242499999999,136798,1,136798,50.0,6839950.0,89866742.9245625,True
7/18/11,2011-07-18 23:59:59,13.631213571428573,13.832436944444444,136968,1,136968,50.0,6848450.0,93352684.58325002,True
7/19/11,2011-07-19 23:59:59,13.892201052631586,14.627571010101015,137110,1,137110,50.0,6855550.0,95238678.92636847,True
7/20/11,2011-07-20 23:59:59,13.688931578947368,13.947273999999995,137259,1,137259,50.0,6863000.0,93947137.42631578,True
7/21/11,2011-07-21 23:59:59,13.597777777777774,13.740167999999999,137411,1,137411,50.0,6870600.0,93424891.99999997,True
7/22/11,2011-07-22 23:59:59,13.660361666666667,13.769037000000004,137562,1,137562,50.0,6878150.0,93958016.59758334,True
7/23/11,2011-07-23 23:59:59,13.69,13.718934,137708,1,137708,50.0,6885450.0,94261810.5,True
7/24/11,2011-07-24 23:59:59,13.961882500000005,14.012300000000002,137874,1,137874,50.0,6893750.0,96249727.48437503,True
7/25/11,2011-07-25 23:59:59,13.994955,14.405845584415589,138039,1,138039,50.0,6902000.0,96593179.41,True
7/26/11,2011-07-26 23:59:59,13.88086,14.038446000000002,138215,1,138215,50.0,6910800.0,95927847.288,True
7/27/11,2011-07-27 23:59:59,13.774669655172412,14.085714285714285,138389,1,138389,50.0,6919500.0,95313826.67896551,True
7/28/11,2011-07-28 23:59:59,13.474066666666666,13.904979999999998,138544,1,138544,50.0,6927250.0,93338228.31666666,True
7/29/11,2011-07-29 23:59:59,13.50101375,13.669702666666668,138708,1,138708,50.0,6935450.0,93635605.8124375,True
7/30/11,2011-07-30 23:59:59,13.528286666666665,13.599955833333333,138860,1,138860,50.0,6943050.0,93927570.74099998,True
7/31/11,2011-07-31 23:59:59,13.3503,14.8999,139035,1,139035,50.0,6951800.0,92808615.54,True
8/1/11,2011-08-01 23:59:59,13.021102857142855,13.54,139200,1,139200,50.0,6960050.0,90627526.94085713,True
8/2/11,2011-08-02 23:59:59,12.0096456,13.099969999999999,139354,1,139354,50.0,6967750.0,83680208.1294,True
8/3/11,2011-08-03 23:59:59,9.2928475,12.0096456,139511,1,139511,50.0,6975600.0,64823187.021000005,True
8/4/11,2011-08-04 23:59:59,10.75,11.086422222222224,139640,1,139640,50.0,6982050.0,75057037.5,True
8/5/11,2011-08-05 23:59:59,9.717907999999998,10.948,139780,1,139780,50.0,6989050.0,67918944.90739998,True
8/6/11,2011-08-06 23:59:59,6.573078125,9.884455652173907,139902,1,139902,50.0,6995150.0,45979667.44609375,True
8/7/11,2011-08-07 23:59:59,7.803974761904764,8.926713250000002,140028,1,140028,50.0,7001450.0,54639139.096738115,True
8/8/11,2011-08-08 23:59:59,7.8009059999999995,8.051086000000002,140164,1,140164,50.0,7008250.0,54670699.47449999,True
8/9/11,2011-08-09 23:59:59,9.9818808,11.409299745222937,140310,1,140310,50.0,7015550.0,70028383.84644,True
8/10/11,2011-08-10 23:59:59,10.296990499999994,10.400002857142855,140462,1,140462,50.0,7023150.0,72317308.83007497,True
8/11/11,2011-08-11 23:59:59,9.459795,10.296990499999994,140599,1,140599,50.0,7030000.0,66502358.85,True
8/12/11,2011-08-12 23:59:59,9.465375,9.71990375,140730,1,140730,50.0,7036550.0,66603584.45625,True
8/13/11,2011-08-13 23:59:59,10.209019104477623,10.123339655172405,140860,1,140860,50.0,7043050.0,71902632.00379112,True
8/14/11,2011-08-14 23:59:59,10.753698333333332,11.182393749999996,140992,1,140992,50.0,7049650.0,75809809.45558333,True
8/15/11,2011-08-15 23:59:59,11.13637,11.531436734693875,141121,1,141121,50.0,7056100.0,78579340.357,True
8/16/11,2011-08-16 23:59:59,10.941880000000001,11.31992142857143,141268,1,141268,50.0,7063450.0,77287422.28600001,True
8/17/11,2011-08-17 23:59:59,10.942427499999999,11.095001111111115,141404,1,141404,50.0,7070250.0,77365698.031875,True
8/18/11,2011-08-18 23:59:59,10.9,11.026683333333335,141548,1,141548,50.0,7077450.0,77144205.0,True
8/19/11,2011-08-19 23:59:59,11.634872857142856,11.715109565217393,141679,1,141679,50.0,7084000.0,82421439.32,True
8/20/11,2011-08-20 23:59:59,11.460875,11.656322727272727,141831,1,141831,50.0,7091600.0,81275941.14999999,True
8/21/11,2011-08-21 23:59:59,11.192880877192977,11.4992,141991,1,141991,50.0,7099600.0,79464977.07571925,True
8/22/11,2011-08-22 23:59:59,10.940764736842107,11.41934982608696,142160,1,142160,50.0,7108050.0,77767502.78771053,True
8/23/11,2011-08-23 23:59:59,10.9909,11.190862222222226,142315,1,142315,50.0,7115800.0,78209046.22,True
8/24/11,2011-08-24 23:59:59,10.876112,11.066546666666666,142449,1,142449,50.0,7122500.0,77465107.72,True
8/25/11,2011-08-25 23:59:59,9.646787,10.876112,142584,1,142584,50.0,7129250.0,68774356.21975,True
8/26/11,2011-08-26 23:59:59,8.198848,9.812717272727275,142731,1,142731,50.0,7136600.0,58511898.6368,True
8/27/11,2011-08-27 23:59:59,8.62423,9.09696518987341,142853,1,142853,50.0,7142700.0,61600287.62100001,True
8/28/11,2011-08-28 23:59:59,9.00655588235294,9.470205609756096,142969,1,142969,50.0,7148500.0,64383364.72499999,True
8/29/11,2011-08-29 23:59:59,8.968902,9.252313000000001,143107,1,143107,50.0,7155400.0,64176081.370799996,True
8/30/11,2011-08-30 23:59:59,8.78838,9.0,143253,1,143253,50.0,7162700.0,62948529.426,True
8/31/11,2011-08-31 23:59:59,8.219663333333335,8.78838,143408,1,143408,50.0,7170450.0,58938684.94850001,True
9/1/11,2011-09-01 23:59:59,8.285931249999999,8.37,143537,1,143537,50.0,7176900.0,59467299.988125,True
9/2/11,2011-09-02 23:59:59,8.578949,8.62278,143693,1,143693,50.0,7184700.0,61637174.8803,True
9/3/11,2011-09-03 23:59:59,8.4632,8.75,143838,1,143838,50.0,7191950.0,60866911.24,True
9/4/11,2011-09-04 23:59:59,8.0726,8.5,143972,1,143972,50.0,7198650.0,58111821.989999995,True
9/5/11,2011-09-05 23:59:59,7.639191999999999,8.1,144128,1,144128,50.0,7206450.0,55051455.18839999,True
9/6/11,2011-09-06 23:59:59,6.856137,7.639191999999999,144278,1,144278,50.0,7213950.0,49459829.51115,True
9/7/11,2011-09-07 23:59:59,7.154934999999999,7.391202222222222,144415,1,144415,50.0,7220800.0,51664354.647999994,True
9/8/11,2011-09-08 23:59:59,6.506196086956522,7.154934999999999,144544,1,144544,50.0,7227250.0,47021905.66945653,True
9/9/11,2011-09-09 23:59:59,5.0138525,6.506196086956522,144698,1,144698,50.0,7234950.0,36274972.144875,True
9/10/11,2011-09-10 23:59:59,4.7599550000000015,5.365683384615385,144831,1,144831,50.0,7241600.0,34469690.12800001,True
9/11/11,2011-09-11 23:59:59,5.916086666666666,7.014375919999997,144956,1,144956,50.0,7247850.0,42878908.746999994,True
9/12/11,2011-09-12 23:59:59,6.002246,6.411242499999998,145089,1,145089,50.0,7254500.0,43543293.607,True
9/13/11,2011-09-13 23:59:59,5.786903333333332,6.074840000000001,145231,1,145231,50.0,7261600.0,42022177.24533332,True
9/14/11,2011-09-14 23:59:59,5.595219999999998,5.846416666666666,145377,1,145377,50.0,7268900.0,40671094.657999985,True
9/15/11,2011-09-15 23:59:59,4.810005,5.6,145533,1,145533,50.0,7276700.0,35000963.3835,True
9/16/11,2011-09-16 23:59:59,4.8309364285714285,4.983363636363637,145652,1,145652,50.0,7282650.0,35182019.18153571,True
9/17/11,2011-09-17 23:59:59,4.583806666666667,4.90592,145786,1,145786,50.0,7289350.0,33412971.125666667,True
9/18/11,2011-09-18 23:59:59,5.211500000000001,5.456285671641789,145944,1,145944,50.0,7297250.0,38029618.37500001,True
9/19/11,2011-09-19 23:59:59,5.561336923076923,5.5987245833333334,146071,1,146071,50.0,7303600.0,40617780.35138462,True
9/20/11,2011-09-20 23:59:59,6.11124375,6.661117999999999,146211,1,146211,50.0,7310600.0,44676858.558749996,True
9/21/11,2011-09-21 23:59:59,5.635087,6.1517775000000015,146357,1,146357,50.0,7317900.0,41237003.1573,True
9/22/11,2011-09-22 23:59:59,5.476955,5.815415333333332,146505,1,146505,50.0,7325300.0,40120338.461500004,True
9/23/11,2011-09-23 23:59:59,5.5652800000000004,5.681685238095238,146638,1,146638,50.0,7331950.0,40804354.696,True
9/24/11,2011-09-24 23:59:59,5.4545200000000005,5.74,146767,1,146767,50.0,7338400.0,40027449.568,True
9/25/11,2011-09-25 23:59:59,5.32809,5.489,146904,1,146904,50.0,7345250.0,39136153.072500005,True
9/26/11,2011-09-26 23:59:59,4.8693,5.595,147038,1,147038,50.0,7351950.0,35798850.135,True
9/27/11,2011-09-27 23:59:59,4.9331690909090895,5.128708571428572,147171,1,147171,50.0,7358600.0,36301218.07236362,True
9/28/11,2011-09-28 23:59:59,4.710979999999998,4.94895,147318,1,147318,50.0,7365950.0,34700843.13099999,True
9/29/11,2011-09-29 23:59:59,4.7442028571428585,4.796749999999998,147443,1,147443,50.0,7372200.0,34975212.30342858,True
9/30/11,2011-09-30 23:59:59,5.08517,5.254366896551724,147565,1,147565,50.0,7378300.0,37519909.811,True
10/1/11,2011-10-01 23:59:59,5.03241,5.16035911764706,147708,1,147708,50.0,7385450.0,37166612.434499994,True
10/2/11,2011-10-02 23:59:59,5.024095,5.095115,147829,1,147829,50.0,7391500.0,37135598.1925,True
10/3/11,2011-10-03 23:59:59,5.004244,5.02618,147974,1,147974,50.0,7398750.0,37025150.295,True
10/4/11,2011-10-04 23:59:59,4.929115,5.020843571428571,148086,1,148086,50.0,7404350.0,36496892.65025,True
10/5/11,2011-10-05 23:59:59,4.867565,4.964361111111111,148231,1,148231,50.0,7411600.0,36076444.754,True
10/6/11,2011-10-06 23:59:59,4.735073333333333,4.898903333333333,148359,1,148359,50.0,7418000.0,35124773.986666664,True
10/7/11,2011-10-07 23:59:59,4.30847,4.768661428571429,148497,1,148497,50.0,7424900.0,31989958.902999997,True
10/8/11,2011-10-08 23:59:59,4.030948888888889,4.43515,148616,1,148616,50.0,7430850.0,29953376.551000003,True
10/9/11,2011-10-09 23:59:59,4.100494444444443,4.347861764705882,148743,1,148743,50.0,7437200.0,30496197.282222215,True
10/10/11,2011-10-10 23:59:59,4.0706175,4.1949,148866,1,148866,50.0,7443350.0,30299030.768625,True
10/11/11,2011-10-11 23:59:59,3.9574759999999998,4.17,148959,1,148959,50.0,7448000.0,29475281.248,True
10/12/11,2011-10-12 23:59:59,4.182036666666667,4.1970127272727265,149079,1,149079,50.0,7454000.0,31172901.313333336,True
10/13/11,2011-10-13 23:59:59,4.037833333333332,4.193987272727273,149176,1,149176,50.0,7458850.0,30117593.15833332,True
10/14/11,2011-10-14 23:59:59,3.9898857142857143,4.0860475,149315,1,149315,50.0,7465800.0,29787688.765714284,True
10/15/11,2011-10-15 23:59:59,3.8462300000000003,4.08,149449,1,149449,50.0,7472500.0,28740953.675,True
10/16/11,2011-10-16 23:59:59,3.544189166666666,3.8855205263157893,149568,1,149568,50.0,7478450.0,26505041.473458327,True
10/17/11,2011-10-17 23:59:59,2.546378499999999,3.713821250000001,149686,1,149686,50.0,7484350.0,19057987.926474992,True
10/18/11,2011-10-18 23:59:59,2.416001034482758,2.872716296296297,149806,1,149806,50.0,7490350.0,18096693.348637927,True
10/19/11,2011-10-19 23:59:59,2.257678399999998,2.490330454545454,149939,1,149939,50.0,7497000.0,16925814.964799985,True
10/20/11,2011-10-20 23:59:59,2.38852923076923,2.379988571428572,150054,1,150054,50.0,7502750.0,17920537.68615384,True
10/21/11,2011-10-21 23:59:59,2.5687724999999992,2.7000844,150175,1,150175,50.0,7508800.0,19288398.947999995,True
10/22/11,2011-10-22 23:59:59,3.14305,3.274616,150273,1,150273,50.0,7513700.0,23615934.785,True
10/23/11,2011-10-23 23:59:59,3.15583303030303,3.199963333333333,150381,1,150381,50.0,7519100.0,23729024.138151515,True
10/24/11,2011-10-24 23:59:59,2.560124180727159,3.169455,150508,1,150508,50.0,7525450.0,19266086.5158532,True
10/25/11,2011-10-25 23:59:59,2.7303375,2.991972716049383,150637,1,150637,50.0,7531900.0,20564629.01625,True
10/26/11,2011-10-26 23:59:59,2.773225,2.838217555555555,150754,1,150754,50.0,7537750.0,20903876.743750002,True
10/27/11,2011-10-27 23:59:59,3.0857087500000002,3.060018,150854,1,150854,50.0,7542750.0,23274729.6740625,True
10/28/11,2011-10-28 23:59:59,3.1631,3.375308,150959,1,150959,50.0,7548000.0,23875078.8,True
10/29/11,2011-10-29 23:59:59,3.621062857142857,3.740070714285713,151072,1,151072,50.0,7553650.0,27352241.45085714,True
10/30/11,2011-10-30 23:59:59,3.222598369955656,3.6451575,151183,1,151183,50.0,7559200.0,24360265.598168794,True
10/31/11,2011-10-31 23:59:59,3.29355,3.301144999999999,151314,1,151314,50.0,7565750.0,24918175.9125,True
11/1/11,2011-11-01 23:59:59,3.179435714285714,3.330003181818182,151464,1,151464,50.0,7573250.0,24078661.523214284,True
11/2/11,2011-11-02 23:59:59,3.235216666666666,3.298858333333333,151618,1,151618,50.0,7580950.0,24526015.789166663,True
11/3/11,2011-11-03 23:59:59,3.19465,3.260066,151743,1,151743,50.0,7587200.0,24238448.48,True
11/4/11,2011-11-04 23:59:59,3.11038,3.247505,151890,1,151890,50.0,7594550.0,23621936.429,True
11/5/11,2011-11-05 23:59:59,2.9700100000000003,3.146316000000001,152036,1,152036,50.0,7601850.0,22577570.5185,True
11/6/11,2011-11-06 23:59:59,2.956696666666666,2.9999000000000002,152180,1,152180,50.0,7609050.0,22497652.771499995,True
11/7/11,2011-11-07 23:59:59,3.0318,3.028975999999999,152312,1,152312,50.0,7615650.0,23089127.67,True
11/8/11,2011-11-08 23:59:59,3.092341333333333,3.179611428571428,152461,1,152461,50.0,7623100.0,23573227.21813333,True
11/9/11,2011-11-09 23:59:59,2.8998024,3.158613333333333,152622,1,152622,50.0,7631150.0,22128827.08476,True
11/10/11,2011-11-10 23:59:59,2.8735303174603173,3.046666666666667,152763,1,152763,50.0,7638200.0,21948599.270825397,True
11/11/11,2011-11-11 23:59:59,3.062335555555556,3.3,152883,1,152883,50.0,7644200.0,23409105.45377778,True
11/12/11,2011-11-12 23:59:59,3.020965,3.10986,153025,1,153025,50.0,7651300.0,23114309.504499998,True
11/13/11,2011-11-13 23:59:59,2.99572,3.08427,153169,1,153169,50.0,7658500.0,22942721.62,True
11/14/11,2011-11-14 23:59:59,2.236508536585365,2.99572,153312,1,153312,50.0,7665650.0,17144291.663475603,True
11/15/11,2011-11-15 23:59:59,2.336816429529768,2.490383030303029,153477,1,153477,50.0,7673900.0,17932495.598568488,True
11/16/11,2011-11-16 23:59:59,2.560046,2.571498989158609,153612,1,153612,50.0,7680650.0,19662817.309899997,True
11/17/11,2011-11-17 23:59:59,2.233934193548386,2.5775,153751,1,153751,50.0,7687600.0,17173592.50632257,True
11/18/11,2011-11-18 23:59:59,2.05435,2.38905,153884,1,153884,50.0,7694250.0,15806682.487499999,True
11/19/11,2011-11-19 23:59:59,2.205495,2.2813866666666662,154007,1,154007,50.0,7700400.0,16983193.698,True
11/20/11,2011-11-20 23:59:59,2.208781176470588,2.409056666666667,154150,1,154150,50.0,7707550.0,17024291.35670588,True
11/21/11,2011-11-21 23:59:59,2.29660375,2.4725025,154268,1,154268,50.0,7713450.0,17714738.195437502,True
11/22/11,2011-11-22 23:59:59,2.329995555555556,2.397343333333333,154408,1,154408,50.0,7720450.0,17988614.186888892,True
11/23/11,2011-11-23 23:59:59,2.32832,2.37996,154542,1,154542,50.0,7727150.0,17991277.888,True
11/24/11,2011-11-24 23:59:59,2.428426666666666,2.516797818181821,154655,1,154655,50.0,7732800.0,18778537.727999993,True
11/25/11,2011-11-25 23:59:59,2.547086666666666,2.5642075,154790,1,154790,50.0,7739550.0,19713304.610999994,True
11/26/11,2011-11-26 23:59:59,2.48191,2.547086666666666,154910,1,154910,50.0,7745550.0,19223758.0005,True
11/27/11,2011-11-27 23:59:59,2.4817533333333333,2.49,155024,1,155024,50.0,7751250.0,19236690.525,True
11/28/11,2011-11-28 23:59:59,2.544334,2.547295294117646,155151,1,155151,50.0,7757600.0,19737925.4384,True
11/29/11,2011-11-29 23:59:59,2.7400100000000003,2.940756411357517,155289,1,155289,50.0,7764500.0,21274807.645000003,True
11/30/11,2011-11-30 23:59:59,3.012862,3.06401115942029,155451,1,155451,50.0,7772600.0,23417771.1812,True
12/1/11,2011-12-01 23:59:59,3.0548,3.1340511111111122,155633,1,155633,50.0,7781700.0,23771537.16,True
12/2/11,2011-12-02 23:59:59,3.112111999999999,3.125041666666666,155779,1,155779,50.0,7789000.0,24240240.36799999,True
12/3/11,2011-12-03 23:59:59,2.773393673469386,3.11238,155931,1,155931,50.0,7796600.0,21623041.114571415,True
12/4/11,2011-12-04 23:59:59,2.78396,2.8541253846153842,156067,1,156067,50.0,7803400.0,21724353.464,True
12/5/11,2011-12-05 23:59:59,2.909111052631578,2.9289325,156225,1,156225,50.0,7811300.0,22723939.165421046,True
12/6/11,2011-12-06 23:59:59,3.0248,3.04778,156395,1,156395,50.0,7819800.0,23653331.04,True
12/7/11,2011-12-07 23:59:59,2.809825,3.123333333333333,156534,1,156534,50.0,7826750.0,21991797.81875,True
12/8/11,2011-12-08 23:59:59,2.991946,3.0696775,156698,1,156698,50.0,7834950.0,23441747.3127,True
12/9/11,2011-12-09 23:59:59,2.962,3.029438571428571,156845,1,156845,50.0,7842300.0,23228892.6,True
12/10/11,2011-12-10 23:59:59,3.062217142857143,3.094995,156989,1,156989,50.0,7849500.0,24036873.462857142,True
12/11/11,2011-12-11 23:59:59,3.26,3.351495,157141,1,157141,50.0,7857100.0,25614146.0,True
12/12/11,2011-12-12 23:59:59,3.164008181818181,3.28421,157268,1,157268,50.0,7863450.0,24880020.137318175,True
12/13/11,2011-12-13 23:59:59,3.227554285714285,3.59,157400,1,157400,50.0,7870050.0,25401013.60628571,True
12/14/11,2011-12-14 23:59:59,3.13921,3.248028333333333,157553,1,157553,50.0,7877700.0,24729754.617,True
12/15/11,2011-12-15 23:59:59,3.180309999999999,3.39,157665,1,157665,50.0,7883300.0,25071337.82299999,True
12/16/11,2011-12-16 23:59:59,3.206595,3.366666666666666,157783,1,157783,50.0,7889200.0,25297469.274,True
12/17/11,2011-12-17 23:59:59,3.18809,3.299155,157933,1,157933,50.0,7896700.0,25175390.303,True
